Stop Deceptive Advertising for Women's Services Act of 2013|113|Senate|Robert Menendez(D) |Read twice and referred to the Committee on Commerce, Science, and Transportation.|2013-05-16|https://www.congress.gov/113/bills/s981/BILLS-113s981is.pdf
A concurrent resolution authorizing the use of Emancipation Hall in the Capitol Visitor Center for an event to celebrate the birthday of King Kamehameha.|113|Senate|Mazie Hirono(D) |Motion to reconsider laid on the table Agreed to without objection.|2013-05-14|https://www.congress.gov/113/bills/sconres10/BILLS-113sconres10enr.pdf
No Taxpayer Funding for Abortion Act|113|Senate|Roger Wicker(R) |Read twice and referred to the Committee on Finance.|2013-05-14|https://www.congress.gov/113/bills/s946/BILLS-113s946is.pdf
Pregnant Workers Fairness Act|113|Senate|Bob Casey(D) |Read twice and referred to the Committee on Health, Education, Labor, and Pensions.|2013-05-14|https://www.congress.gov/113/bills/s942/BILLS-113s942is.pdf
Establishing the Special Committee on Sexual Assault and Abuse in the Armed Forces to conduct oversight, ensure accountability, and report on the activities of the Department of Defense to prevent, reduce, prosecute, and provide victims' services for cases of sexual assault and abuse in the Armed Forces.|113|House|BETTY MCCOLLUM(D) |Referred to the House Committee on Rules.|2013-05-14|https://www.congress.gov/113/bills/hres213/BILLS-113hres213ih.pdf
Supporting Working Moms Act of 2013|113|Senate|Jeff Merkley(D) |Read twice and referred to the Committee on Health, Education, Labor, and Pensions.|2013-05-13|https://www.congress.gov/113/bills/s934/BILLS-113s934is.pdf
Supporting Working Moms Act of 2013|113|House|CAROLYN MALONEY(D) |Referred to the House Committee on Education and the Workforce.|2013-05-09|https://www.congress.gov/113/bills/hr1941/BILLS-113hr1941ih.pdf
Mother's Day Centennial Commemorative Coin Act|113|House|David McKinley(R) |Referred to the House Committee on Financial Services.|2013-05-09|https://www.congress.gov/113/bills/hr1905/BILLS-113hr1905ih.pdf
A resolution expressing the sense of the Senate that Congress and the States should investigate and correct abusive, unsanitary, and illegal abortion practices.|113|Senate|Mike Lee(R) |Referred to the Committee on Health, Education, Labor, and Pensions. (text of measure as introduced: CR S3263)|2013-05-08|https://www.congress.gov/113/bills/sres133/BILLS-113sres133is.pdf
District of Columbia Pain-Capable Unborn Child Protection Act|113|Senate|Mike Lee(R) |Read twice and referred to the Committee on Homeland Security and Governmental Affairs.|2013-05-07|https://www.congress.gov/113/bills/s886/BILLS-113s886is.pdf
Pregnant and Parenting Students Access to Education Act of 2013|113|Senate|TOM UDALL(D) |Read twice and referred to the Committee on Health, Education, Labor, and Pensions.|2013-05-07|https://www.congress.gov/113/bills/s870/BILLS-113s870is.pdf
Recognizing the disparate impact of climate change on women and the efforts of women globally to address climate change.|113|House|BARBARA LEE(D) |Referred to the Subcommittee on Energy and Power.|2013-05-03|https://www.congress.gov/113/bills/hconres36/BILLS-113hconres36ih.pdf
Supporting the goals and ideals of Sexual Assault Awareness and Prevention Month.|113|House|Gwen Moore(D) |Referred to the Subcommittee on Crime, Terrorism, Homeland Security, and Investigations.|2013-04-30|https://www.congress.gov/113/bills/hres193/BILLS-113hres193ih.pdf
Supporting the goals and ideals of the National Day of Silence in bringing attention to anti-lesbian, gay, bisexual, and transgender name-calling, bullying, and harassment faced by individuals in schools.|113|House|ELIOT ENGEL(D) |Referred to the Subcommittee on the Constitution and Civil Justice.|2013-04-30|https://www.congress.gov/113/bills/hconres33/BILLS-113hconres33ih.pdf
A resolution congratulating the University of Minnesota women's ice hockey team on winning its second straight National Collegiate Athletic Association Women's Ice Hockey Championship.|113|Senate|Amy Klobuchar(D) |Submitted in the Senate, considered, and agreed to without amendment and with a preamble by Unanimous Consent. (consideration: CR S3060; text as passed Senate: CR S3049)|2013-04-25|https://www.congress.gov/113/bills/sres123/BILLS-113sres123ats.pdf
A resolution recognizing and supporting the goals and ideals of National Sexual Assault Awareness and Prevention Month.|113|Senate|Bob Casey(D) |Referred to the Committee on the Judiciary. (text of measure as introduced: CR S3046-3047)|2013-04-25|https://www.congress.gov/113/bills/sres117/BILLS-113sres117is.pdf
Jacob Sexton Military Suicide Prevention Act of 2013|113|Senate|Joe Donnelly(D) |Read twice and referred to the Committee on Armed Services.|2013-04-25|https://www.congress.gov/113/bills/s810/BILLS-113s810is.pdf
Women and Workforce Investment for Nontraditional Jobs|113|House|Jared Polis(D) |Referred to the Subcommittee on Higher Education and Workforce Training.|2013-04-23|https://www.congress.gov/113/bills/hr951/BILLS-113hr951ih.pdf
Campus Sexual Violence Elimination Act|113|House|CAROLYN MALONEY(D) |Referred to the Subcommittee on Higher Education and Workforce Training.|2013-04-23|https://www.congress.gov/113/bills/hr812/BILLS-113hr812ih.pdf
Violence Against Women Reauthorization Act of 2013|113|House|Gwen Moore(D) |Referred to the Subcommittee on Higher Education and Workforce Training.|2013-04-23|https://www.congress.gov/113/bills/hr11/BILLS-113hr11ih.pdf
A concurrent resolution commending the Boys & Girls Clubs of America for its role in improving outcomes for millions of young people and thousands of communities.|113|Senate|Bob Casey(D) |Referred to the Committee on the Judiciary. (text of measure as introduced: CR S2751-2752)|2013-04-17|https://www.congress.gov/113/bills/sconres13/BILLS-113sconres13is.pdf
A resolution commending and congratulating the University of Louisville men's basketball team for winning its third Division I National Collegiate Athletic Association championship, and the University of Louisville women's basketball team for being runner up in the 2013 Women's Division I National Collegiate Athletic Association Basketball Tournament.|113|Senate|Mitch McConnell(R) |Submitted in the Senate, considered, and agreed to without amendment and with a preamble by Unanimous Consent. (consideration: CR S2696; text as passed Senate: CR S2688)|2013-04-16|https://www.congress.gov/113/bills/sres100/BILLS-113sres100ats.pdf
Supporting the goals of Golf Day in America and congratulating the communities of Pittsford and Rochester, New York, which are hosting the Ladies Professional Golf Association and the Professional Golf Association Championships in 2013.|113|House|LOUISE SLAUGHTER(D) |Referred to the House Committee on Oversight and Government Reform.|2013-04-16|https://www.congress.gov/113/bills/hres165/BILLS-113hres165ih.pdf
Domestic Violence Survivor Protection Act|113|House|LOIS CAPPS(D) |Referred to the Subcommittee on Crime, Terrorism, Homeland Security, And Investigations.|2013-04-15|https://www.congress.gov/113/bills/hr1177/BILLS-113hr1177ih.pdf
Lyme and Tick-Borne Disease Prevention, Education, and Research Act of 2013|113|Senate|Richard Blumenthal(D) |Read twice and referred to the Committee on Health, Education, Labor, and Pensions.|2013-04-11|https://www.congress.gov/113/bills/s719/BILLS-113s719is.pdf
A resolution recognizing linemen, the profession of linemen, the contributions of these brave men and women who protect the public safety, and expressing support for the designation of April 18, 2013, as National Lineman Appreciation Day.|113|Senate|Johnny Isakson(R) |Submitted in the Senate, considered, and agreed to without amendment and with a preamble by Unanimous Consent. (consideration: CR S2569; text as passed Senate: CR S2568)|2013-04-10|https://www.congress.gov/113/bills/sres95/BILLS-113sres95ats.pdf
Recognizing the significance of Equal Pay Day to illustrate the disparity between wages paid to men and women.|113|House|Lois Frankel(D) |Referred to the House Committee on Oversight and Government Reform.|2013-04-09|https://www.congress.gov/113/bills/hconres28/BILLS-113hconres28ih.pdf
To improve services for victims of sexual assault and domestic violence.|113|House|Gregorio Sablan(D) |Referred to the Subcommittee on Crime, Terrorism, Homeland Security, And Investigations.|2013-04-08|https://www.congress.gov/113/bills/hr840/BILLS-113hr840ih.pdf
Violence Against Indian Women Act of 2013|113|House|DARRELL ISSA(R) |Referred to the Subcommittee on Crime, Terrorism, Homeland Security, And Investigations.|2013-04-08|https://www.congress.gov/113/bills/hr780/BILLS-113hr780ih.pdf
SAVE Native Women Act|113|House|BETTY MCCOLLUM(D) |Referred to the Subcommittee on Crime, Terrorism, Homeland Security, And Investigations.|2013-04-08|https://www.congress.gov/113/bills/hr757/BILLS-113hr757ih.pdf
Child Interstate Abortion Notification Act|113|House|ILEANA ROS-LEHTINEN(R) |Referred to the Subcommittee on Crime, Terrorism, Homeland Security, And Investigations.|2013-04-08|https://www.congress.gov/113/bills/hr732/BILLS-113hr732ih.pdf
Violence Against Immigrant Women Act of 2013|113|House|JANICE SCHAKOWSKY(D) |Referred to the Subcommittee on Crime, Terrorism, Homeland Security, And Investigations.|2013-04-08|https://www.congress.gov/113/bills/hr629/BILLS-113hr629ih.pdf
MARCH for Military Women Act|113|House|LOUISE SLAUGHTER(D) |Referred to the Subcommittee on Military Personnel.|2013-04-08|https://www.congress.gov/113/bills/hr1389/BILLS-113hr1389ih.pdf
Recognizing the importance of frontline health workers toward accelerating progress on global health and saving the lives of women and children, and for other purposes.|113|House|NITA LOWEY(D) |Referred to the House Committee on Foreign Affairs.|2013-03-21|https://www.congress.gov/113/bills/hres135/BILLS-113hres135ih.pdf
A resolution designating April 5, 2013, as "Gold Star Wives Day".|113|Senate|Richard Burr(R) |Resolution agreed to in Senate without amendment and with a preamble by Unanimous Consent.|2013-03-20|https://www.congress.gov/113/bills/sres67/BILLS-113sres67ats.pdf
A resolution supporting the goals and ideals of Take Our Daughters and Sons To Work Day.|113|Senate|Richard Burr(R) |Submitted in the Senate, considered, and agreed to without amendment and with a preamble by Unanimous Consent. (consideration: CR S1911; text as passed Senate: CR S1908)|2013-03-18|https://www.congress.gov/113/bills/sres79/BILLS-113sres79ats.pdf
Women Veterans and Other Health Care Improvements Act of 2013|113|House|RICK LARSEN(D) |Referred to the Subcommittee on Military Personnel.|2013-03-14|https://www.congress.gov/113/bills/hr958/BILLS-113hr958ih.pdf
A resolution supporting the goals of International Women's Day.|113|Senate|Jeanne Shaheen(D) |Submitted in the Senate, considered, and agreed to without amendment and with a preamble by Unanimous Consent. (consideration: CR S1669; text as passed Senate: CR S1598; text of measure as introduced: CR S1598)|2013-03-11|https://www.congress.gov/113/bills/sres74/BILLS-113sres74ats.pdf
Violence Against Women Reauthorization Act of 2013|113|Senate|Patrick Leahy(D) |Became Public Law No: 113-4.|2013-03-07|https://www.congress.gov/113/bills/s47/BILLS-113s47enr.pdf
To amend the Military Selective Service Act to require the registration of women with the Selective Service System in light of the Department of Defense elimination of the rule excluding women from direct ground combat assignments in the Armed Forces.|113|House|CHARLES RANGEL(D) |Referred to the Subcommittee on Military Personnel.|2013-03-06|https://www.congress.gov/113/bills/hr747/BILLS-113hr747ih.pdf
A joint resolution proposing an amendment to the Constitution of the United States relative to equal rights for men and women.|113|Senate|Robert Menendez(D) |Read twice and referred to the Committee on the Judiciary.|2013-03-05|https://www.congress.gov/113/bills/sjres10/BILLS-113sjres10is.pdf
Expressing the sense of the House of Representatives regarding women's health and economic security.|113|House|JANICE SCHAKOWSKY(D) |Referred to the Subcommittee on Health.|2013-03-01|https://www.congress.gov/113/bills/hres94/BILLS-113hres94ih.pdf
Quality Care for Moms and Babies Act|113|House|ELIOT ENGEL(D) |Referred to the Subcommittee on Health.|2013-03-01|https://www.congress.gov/113/bills/hr896/BILLS-113hr896ih.pdf
Quality Care for Moms and Babies Act|113|Senate|Debbie Stabenow(D) |Read twice and referred to the Committee on Finance.|2013-02-28|https://www.congress.gov/113/bills/s425/BILLS-113s425is.pdf
Domestic Violence Judicial Support Act of 2013|113|House|MICHAEL HONDA(D) |Referred to the Subcommittee on Crime, Terrorism, Homeland Security, And Investigations.|2013-02-28|https://www.congress.gov/113/bills/hr393/BILLS-113hr393ih.pdf
Sexual Assault Forensic Evidence Reporting Act of 2013|113|House|Ted Poe(R) |Referred to the Subcommittee on Crime, Terrorism, Homeland Security, And Investigations.|2013-02-28|https://www.congress.gov/113/bills/hr354/BILLS-113hr354ih.pdf
A resolution supporting women's reproductive health.|113|Senate|BARBARA BOXER(D) |Referred to the Committee on Health, Education, Labor, and Pensions. (text of measure as introduced: CR S947)|2013-02-27|https://www.congress.gov/113/bills/sres60/BILLS-113sres60is.pdf
Providing for consideration of the bill (S. 47) To reauthorize the Violence Against Women Act of 1994.|113|House|Richard Nugent(R) |Motion to reconsider laid on the table Agreed to without objection.|2013-02-27|https://www.congress.gov/113/bills/hres83/BILLS-113hres83eh.pdf
Alice Paul Women's Suffrage Congressional Gold Medal Act|113|House|Jon Runyan(R) |Referred to the House Committee on Financial Services.|2013-02-27|https://www.congress.gov/113/bills/hr874/BILLS-113hr874ih.pdf
Expressing the sense of the House of Representatives that the United States should work with the Government of Haiti to address gender-based violence against women and children.|113|House|Frederica Wilson(D) |Referred to the Subcommittee on the Western Hemisphere.|2013-02-25|https://www.congress.gov/113/bills/hres61/BILLS-113hres61ih.pdf
Access to Birth Control Act|113|House|CAROLYN MALONEY(D) |Referred to the Subcommittee on Health.|2013-02-15|https://www.congress.gov/113/bills/hr728/BILLS-113hr728ih.pdf
Lyme and Tick-Borne Diseases Prevention, Education, and Research Act of 2013|113|House|CHRISTOPHER SMITH(R) |Referred to the Subcommittee on Health.|2013-02-15|https://www.congress.gov/113/bills/hr611/BILLS-113hr611ih.pdf
To provide for the establishment of the Tick-Borne Diseases Advisory Committee.|113|House|CHRISTOPHER SMITH(R) |Referred to the Subcommittee on Health.|2013-02-15|https://www.congress.gov/113/bills/hr610/BILLS-113hr610ih.pdf
Child Interstate Abortion Notification Act|113|Senate|Marco Rubio(R) |Read twice and referred to the Committee on the Judiciary.|2013-02-14|https://www.congress.gov/113/bills/s369/BILLS-113s369is.pdf
Unborn Child Pain Awareness Act of 2013|113|Senate|Mike Johanns(R) |Read twice and referred to the Committee on Health, Education, Labor, and Pensions.|2013-02-14|https://www.congress.gov/113/bills/s356/BILLS-113s356is.pdf
Access to Birth Control Act|113|Senate|FRANK LAUTENBERG(D) |Read twice and referred to the Committee on Health, Education, Labor, and Pensions.|2013-02-14|https://www.congress.gov/113/bills/s333/BILLS-113s333is.pdf
Birthright Citizenship Act of 2013|113|Senate|David Vitter(R) |Read twice and referred to the Committee on the Judiciary.|2013-02-13|https://www.congress.gov/113/bills/s301/BILLS-113s301is.pdf
To amend title 5, United States Code, to provide that Washington's Birthday be observed on February 22, rather than the third Monday in February, of each year.|113|House|FRANK WOLF(R) |Referred to the House Committee on Oversight and Government Reform.|2013-02-13|https://www.congress.gov/113/bills/hr681/BILLS-113hr681ih.pdf
Women and Minorities in STEM Booster Act of 2013|113|Senate|MARY LANDRIEU(D) |Read twice and referred to the Committee on Commerce, Science, and Transportation.|2013-02-12|https://www.congress.gov/113/bills/s288/BILLS-113s288is.pdf
Celebrating the life of President Ronald Wilson Reagan on the anniversary of his birth.|113|House|Trent Franks(R) |Referred to the House Committee on Oversight and Government Reform.|2013-02-06|https://www.congress.gov/113/bills/hres56/BILLS-113hres56ih.pdf
Observing the 100th birthday of civil rights icon Rosa Parks and commemorating her legacy.|113|House|JOHN CONYERS(D) |Referred to the House Committee on the Judiciary.|2013-02-05|https://www.congress.gov/113/bills/hres54/BILLS-113hres54ih.pdf
A bill to award posthumously a Congressional Gold Medal to Addie Mae Collins, Denise McNair, Carole Robertson, and Cynthia Wesley, in recognition of the 50th anniversary of the bombing of the Sixteenth Street Baptist Church, where the 4 little Black girls lost their lives, which served as a catalyst for the Civil Rights Movement.|113|Senate|Richard Shelby(R) |Read twice and referred to the Committee on Banking, Housing, and Urban Affairs.|2013-01-30|https://www.congress.gov/113/bills/s186/BILLS-113s186is.pdf
Birthright Citizenship Act of 2013|113|House|Steve King(R) |Referred to the Subcommittee on Immigration And Border Security.|2013-01-25|https://www.congress.gov/113/bills/hr140/BILLS-113hr140ih.pdf
Pregnancy Assistance Fund Expansion Act|113|Senate|Bob Casey(D) |Read twice and referred to the Committee on Health, Education, Labor, and Pensions.|2013-01-24|https://www.congress.gov/113/bills/s144/BILLS-113s144is.pdf
Pregnant Women Health and Safety Act|113|Senate|David Vitter(R) |Read twice and referred to the Committee on Health, Education, Labor, and Pensions.|2013-01-24|https://www.congress.gov/113/bills/s139/BILLS-113s139is.pdf
Abortion Non-Discrimination Act of 2013|113|Senate|David Vitter(R) |Read twice and referred to the Committee on Health, Education, Labor, and Pensions.|2013-01-24|https://www.congress.gov/113/bills/s137/BILLS-113s137is.pdf
Title X Abortion Provider Prohibition Act|113|Senate|David Vitter(R) |Read twice and referred to the Committee on Health, Education, Labor, and Pensions.|2013-01-24|https://www.congress.gov/113/bills/s135/BILLS-113s135is.pdf
Campus Sexual Violence Elimination Act|113|Senate|Bob Casey(D) |Read twice and referred to the Committee on Health, Education, Labor, and Pensions.|2013-01-24|https://www.congress.gov/113/bills/s128/BILLS-113s128is.pdf
A bill for the relief of Momo Krcic.|113|Senate|CARL LEVIN(D) |Read twice and referred to the Committee on the Judiciary.|2013-01-23|https://www.congress.gov/113/bills/s74/BILLS-113s74is.pdf
A bill to reauthorize the Violence Against Women Act of 1994.|113|Senate|HARRY REID(D) |Read twice and referred to the Committee on the Judiciary. (text of measure as introduced: CR S45)|2013-01-22|https://www.congress.gov/113/bills/s5/BILLS-113s5is.pdf
Recognizing Linemen, the profession of Linemen, and the contributions of these brave men and women to protect public safety, and expressing support for designation of April 18, 2013, as National Lineman Appreciation Day.|113|House|Phil Gingrey(R) |Referred to the Subcommittee on Energy and Power.|2013-01-18|https://www.congress.gov/113/bills/hres25/BILLS-113hres25ih.pdf
Title X Abortion Provider Prohibition Act|113|House|Marsha Blackburn(R) |Sponsor introductory remarks on measure. (CR H76)|2013-01-14|https://www.congress.gov/113/bills/hr61/BILLS-113hr61ih.pdf
Title X Abortion Provider Prohibition Act|113|House|Diane Black(R) |Referred to the Subcommittee on Health.|2013-01-04|https://www.congress.gov/113/bills/hr217/BILLS-113hr217ih.pdf
Medicaid Newborn Coverage Act of 2013|113|House|JOSE SERRANO(D) |Referred to the Subcommittee on Health.|2013-01-04|https://www.congress.gov/113/bills/hr211/BILLS-113hr211ih.pdf
Expressing the sense of the House of Representatives that the Senate should ratify the Convention on the Elimination of All Forms of Discrimination Against Women (CEDAW).|113|House|CAROLYN MALONEY(D) |Referred to the House Committee on Foreign Affairs.|2013-01-04|https://www.congress.gov/113/bills/hres19/BILLS-113hres19ih.pdf
