Maternal Health Accountability Act of 2014|113|House|JOHN CONYERS(D) |Referred to the Subcommittee on Health.|2014-03-14|https://www.congress.gov/113/bills/hr4216/BILLS-113hr4216ih.pdf
Recognizing linemen, the profession of linemen, the contributions of these brave men and women who protect public safety, and expressing support for the designation of March 31, 2014, as National Lineman Appreciation Day.|113|House|Mick Mulvaney(R) |Referred to the Subcommittee on Energy and Power.|2014-03-14|https://www.congress.gov/113/bills/hres512/BILLS-113hres512ih.pdf
A resolution supporting the goals of International Women's Day.|113|Senate|Jeanne Shaheen(D) |Resolution agreed to in Senate without amendment and an amended preamble by Unanimous Consent.|2014-03-13|https://www.congress.gov/113/bills/sres376/BILLS-113sres376ats.pdf
A resolution supporting the goals and ideals of Take Our Daughters and Sons To Work Day.|113|Senate|Richard Burr(R) |Submitted in the Senate, considered, and agreed to without amendment and with a preamble by Unanimous Consent. (consideration: CR S1527-1528; text as passed Senate: CR S1522)|2014-03-11|https://www.congress.gov/113/bills/sres380/BILLS-113sres380ats.pdf
Expressing the sense of the House of Representatives in support of a women's economic bill of rights.|113|House|Ron Barber(D) |Referred to the House Committee on Education and the Workforce.|2014-03-06|https://www.congress.gov/113/bills/hres507/BILLS-113hres507ih.pdf
A resolution to designate May 22, 2014 as "United States Foreign Service Day" in recognition of the men and women who have served, or are presently serving, in the Foreign Service of the United States, and to honor those in the Foreign Service who have given their lives in the line of duty.|113|Senate|Robert Menendez(D) |Referred to the Committee on the Judiciary. (text of measure as introduced: CR S1283)|2014-03-04|https://www.congress.gov/113/bills/sres369/BILLS-113sres369is.pdf
Equal Rights and Access for the Women of South Sudan Act|113|House|SHEILA JACKSON LEE(D) |Referred to the House Committee on Foreign Affairs.|2014-02-27|https://www.congress.gov/113/bills/hr4112/BILLS-113hr4112ih.pdf
Supporting the goals and ideals of International Mother Language Day in bringing attention to the importance of preserving linguistic and cultural heritage through education.|113|House|Grace Meng(D) |Referred to the House Committee on Oversight and Government Reform.|2014-02-21|https://www.congress.gov/113/bills/hres486/BILLS-113hres486ih.pdf
Newborn Screening Saves Lives Reauthorization Act of 2013|113|Senate|Kay Hagan(D) |Referred to the Subcommittee on Health.|2014-02-07|https://www.congress.gov/113/bills/s1417/BILLS-113s1417rfh.pdf
A resolution congratulating the Penn State University women's volleyball team for winning the 2013 National Collegiate Athletic Association Women's Volleyball Championship.|113|Senate|Patrick Toomey(R) |Submitted in the Senate, considered, and agreed to without amendment and with a preamble by Unanimous Consent. (consideration: CR S773-774; text as passed Senate: CR S767-768)|2014-02-04|https://www.congress.gov/113/bills/sres344/BILLS-113sres344ats.pdf
TRICARE Moms Improvement Act of 2014|113|Senate|Claire McCaskill(D) |Read twice and referred to the Committee on Armed Services.|2014-02-04|https://www.congress.gov/113/bills/s1994/BILLS-113s1994is.pdf
A resolution observing the 100th birthday of civil rights leader Daisy Bates and honoring her legacy as an American heroine.|113|Senate|Mark Pryor(D) |Resolution agreed to in Senate without amendment and with a preamble by Unanimous Consent.|2014-02-03|https://www.congress.gov/113/bills/sres341/BILLS-113sres341ats.pdf
A resolution expressing the sense of the Senate that all necessary measures should be taken to protect children in the United States from human trafficking, especially during the upcoming Super Bowl, an event around which many children are trafficked for sex.|113|Senate|Richard Blumenthal(D) |Resolution agreed to in Senate without amendment and with a preamble by Unanimous Consent.|2014-02-03|https://www.congress.gov/113/bills/sres340/BILLS-113sres340ats.pdf
No Taxpayer Funding for Abortion and Abortion Insurance Full Disclosure Act of 2014|113|House|CHRISTOPHER SMITH(R) |Received in the Senate and Read twice and referred to the Committee on Finance.|2014-01-29|https://www.congress.gov/113/bills/hr7/BILLS-113hr7rfs.pdf
Providing for consideration of the bill (H.R. 7) to prohibit taxpayer funded abortions, and providing for consideration of the conference report to accompany the bill (H.R. 2642) to provide for the reform and continuation of agricultural and other programs of the Department of Agriculture through fiscal year 2018, and for other purposes.|113|House|Virginia Foxx(R) |Motion to reconsider laid on the table Agreed to without objection.|2014-01-28|https://www.congress.gov/113/bills/hres465/BILLS-113hres465eh.pdf
Women, Peace, and Security Act of 2014|113|Senate|BARBARA BOXER(D) |Read twice and referred to the Committee on Foreign Relations.|2014-01-16|https://www.congress.gov/113/bills/s1942/BILLS-113s1942is.pdf
A bill to improve the response to missing children and victims of child sex trafficking.|113|Senate|Rob Portman(R) |Read twice and referred to the Committee on the Judiciary.|2014-01-16|https://www.congress.gov/113/bills/s1936/BILLS-113s1936is.pdf
Expressing the sense of the House of Representatives regarding the September 23, 2013, decision of the Dominican Republic Constitutional Court that places hundreds of thousands of Dominican born persons at risk of statelessness.|113|House|GREGORY MEEKS(D) |Referred to the Subcommittee on the Western Hemisphere.|2014-01-10|https://www.congress.gov/113/bills/hres443/BILLS-113hres443ih.pdf
Expressing the sense of the House of Representatives regarding sexually exploited and trafficked girls in the United States.|113|House|ROSA DELAURO(D) |Referred to the Subcommittee on Crime, Terrorism, Homeland Security, and Investigations.|2014-01-09|https://www.congress.gov/113/bills/hres387/BILLS-113hres387ih.pdf
Domestic Violence Criminal Disarmament Act of 2013|113|House|Gwen Moore(D) |Referred to the Subcommittee on Crime, Terrorism, Homeland Security, and Investigations.|2014-01-09|https://www.congress.gov/113/bills/hr3566/BILLS-113hr3566ih.pdf
Protecting Youth At-Risk for Sex Trafficking Act|113|Senate|MAX BAUCUS(D) |Read twice and referred to the Committee on Finance.|2013-12-19|https://www.congress.gov/113/bills/s1878/BILLS-113s1878is.pdf
Abortion Insurance Full Disclosure Act of 2013|113|Senate|PAT ROBERTS(R) |Read twice and referred to the Committee on Health, Education, Labor, and Pensions.|2013-12-18|https://www.congress.gov/113/bills/s1848/BILLS-113s1848is.pdf
Honoring the accomplishments of Nicarsia "Nikki" Mayes, a Capitol Hill trailblazer and the first African-American woman to serve as a Doorkeeper of the House of Representatives.|113|House|SHEILA JACKSON LEE(D) |Referred to the House Committee on House Administration.|2013-12-12|https://www.congress.gov/113/bills/hres444/BILLS-113hres444ih.pdf
Trans Fat Truth in Labeling Act of 2013|113|House|STEVE ISRAEL(D) |Referred to the Subcommittee on Health.|2013-11-29|https://www.congress.gov/113/bills/hr3624/BILLS-113hr3624ih.pdf
A resolution calling on the International Olympic Committee (IOC) to strongly oppose Russia's discriminatory law against the freedom of expression for lesbian, gay, bisexual, and transgender (LGBT) persons and to obtain written assurance that host countries of the Olympic Games will uphold all international human rights and civil rights obligations for all persons observing or participating in the Games regardless of race, sex, sexual orientation, or gender identity, and for other purposes.|113|Senate|Jeff Merkley(D) |Referred to the Committee on Commerce, Science, and Transportation. (text of measure as introduced: CR S8465-8466)|2013-11-21|https://www.congress.gov/113/bills/sres311/BILLS-113sres311is.pdf
International Violence Against Women Act of 2013|113|House|JANICE SCHAKOWSKY(D) |Referred to the House Committee on Foreign Affairs.|2013-11-21|https://www.congress.gov/113/bills/hr3571/BILLS-113hr3571ih.pdf
Survivors of Military Sexual Assault and Domestic Abuse Act of 2013|113|Senate|Bernard Sanders(I) |Committee on Veterans' Affairs. Ordered to be reported with an amendment in the nature of a substitute favorably.|2013-11-19|https://www.congress.gov/113/bills/s1581/BILLS-113s1581is.pdf
Women's Health Protection Act of 2013|113|House|Judy Chu(D) |Referred to the Subcommittee on Health.|2013-11-15|https://www.congress.gov/113/bills/hr3471/BILLS-113hr3471ih.pdf
A resolution congratulating the Minnesota Lynx women's basketball team on winning the 2013 Women's National Basketball Association Championship.|113|Senate|Al Franken(D) |Submitted in the Senate, considered, and agreed to without amendment and with a preamble by Unanimous Consent. (consideration: CR S8069; text as passed Senate: CR S8056)|2013-11-14|https://www.congress.gov/113/bills/sres297/BILLS-113sres297ats.pdf
A resolution expressing the sense of the Senate on a nationwide moment of remembrance on Memorial Day each year, in order to appropriately honor United States patriots lost in the pursuit of peace and liberty around the world.|113|Senate|Patrick Toomey(R) |Referred to the Committee on the Judiciary. (text of measure as introduced: CR S7962)|2013-11-12|https://www.congress.gov/113/bills/sres291/BILLS-113sres291is.pdf
Pain-Capable Unborn Child Protection Act|113|Senate|Lindsey Graham(R) |Read twice and referred to the Committee on the Judiciary.|2013-11-07|https://www.congress.gov/113/bills/s1670/BILLS-113s1670is.pdf
Memorial Day Moment of Silence Act|113|Senate|MARK KIRK(R) |Read twice and referred to the Committee on the Judiciary.|2013-11-05|https://www.congress.gov/113/bills/s1648/BILLS-113s1648is.pdf
Supporting the goals and ideals of October as National Domestic Violence Awareness Month and expressing the sense of the House of Representatives that Congress should continue to raise awareness of domestic violence and its devastating effects on individuals, families, and communities, and support programs designed to end domestic violence in the United States.|113|House|Al Green(D) |Sponsor introductory remarks on measure. (CR H6935-6936, H6936-6937, H6938, H6939, H6940, H6941)|2013-10-30|https://www.congress.gov/113/bills/hres392/BILLS-113hres392ih.pdf
Protecting Students from Sexual and Violent Predators Act|113|Senate|Patrick Toomey(R) |Read twice and referred to the Committee on Health, Education, Labor, and Pensions.|2013-10-29|https://www.congress.gov/113/bills/s1596/BILLS-113s1596is.pdf
Protecting Students from Sexual and Violent Predators Act|113|House|GEORGE MILLER(D) |Received in the Senate and Read twice and referred to the Committee on Health, Education, Labor, and Pensions.|2013-10-28|https://www.congress.gov/113/bills/hr2083/BILLS-113hr2083rfs.pdf
Congratulating the Minnesota Lynx women's basketball team on winning the 2013 Women's National Basketball Association Championship.|113|House|Keith Ellison(D) |Referred to the House Committee on Oversight and Government Reform.|2013-10-23|https://www.congress.gov/113/bills/hres389/BILLS-113hres389ih.pdf
Abortion Insurance Full Disclosure Act of 2013|113|House|CHRISTOPHER SMITH(R) |Referred to the Subcommittee on Health.|2013-10-11|https://www.congress.gov/113/bills/hr3279/BILLS-113hr3279ih.pdf
Special Supplemental Nutrition Program for Women, Infants, and Children Continuing Appropriations Resolution, 2014|113|House|ROBERT ADERHOLT(R) |Read the second time. Placed on Senate Legislative Calendar under General Orders. Calendar No. 209.|2013-10-07|https://www.congress.gov/113/bills/hjres75/BILLS-113hjres75pcs.pdf
Providing for consideration of the joint resolution (H.J. Res. 75) making continuing appropriations for the Special Supplemental Nutrition Program for Women, Infants, and Children for fiscal year 2014, and for other purposes; providing for consideration of motions to suspend the rules; waiving a requirement of clause 6(a) of rule XIII with respect to consideration of certain resolutions reported from the Committee on Rules; and for other purposes.|113|House|Tom Cole(R) |DEBATE - Mr. Cole asked unanimous consent to modify the text of H.Res. 371 with the amendment at the desk. Agreed to without objection.|2013-10-04|https://www.congress.gov/113/bills/hres371/BILLS-113hres371eh.pdf
Special Supplemental Nutrition Program for Women, Infants, and Children Continuing Appropriations Resolution, 2014|113|House|Tom Cotton(R) |Referred to the House Committee on Appropriations.|2013-10-02|https://www.congress.gov/113/bills/hjres74/BILLS-113hjres74ih.pdf
Global Sexual and Reproductive Health Act of 2013|113|House|Yvette Clarke(D) |Referred to the House Committee on Foreign Affairs.|2013-09-27|https://www.congress.gov/113/bills/hr3206/BILLS-113hr3206ih.pdf
Improving Outcomes for Youth At Risk for Sex Trafficking Act of 2013|113|Senate|ORRIN HATCH(R) |Read twice and referred to the Committee on Finance.|2013-09-18|https://www.congress.gov/113/bills/s1518/BILLS-113s1518is.pdf
Women Veterans and Other Health Care Improvements Act of 2013|113|Senate|Patty Murray(D) |Placed on Senate Legislative Calendar under General Orders. Calendar No. 185.|2013-09-17|https://www.congress.gov/113/bills/s131/BILLS-113s131rs.pdf
Child Sex Trafficking Data and Response Act of 2013|113|House|Erik Paulsen(R) |Referred to the Subcommittee on Early Childhood, Elementary, and Secondary Education.|2013-09-13|https://www.congress.gov/113/bills/hr2744/BILLS-113hr2744ih.pdf
International Women's Freedom Act of 2013|113|House|CAROLYN MALONEY(D) |Referred to the Subcommittee on Immigration and Border Security.|2013-09-13|https://www.congress.gov/113/bills/hr2947/BILLS-113hr2947ih.pdf
Protect Children from Sex Tourism Act of 2013|113|House|Tom Cotton(R) |Referred to the Subcommittee on Crime, Terrorism, Homeland Security, and Investigations.|2013-09-13|https://www.congress.gov/113/bills/hr2915/BILLS-113hr2915ih.pdf
End Sex Trafficking Act of 2013|113|House|Ted Poe(R) |Referred to the Subcommittee on Crime, Terrorism, Homeland Security, and Investigations.|2013-09-13|https://www.congress.gov/113/bills/hr2805/BILLS-113hr2805ih.pdf
Recognizing Bayard Rustin for his lifelong leadership in the civil rights, labor, and lesbian, gay, bisexual, and transgender (LGBT) rights movements and for his exemplary dedication to realizing true equality and freedom in the United States.|113|House|JOHN LEWIS(D) |Referred to the Subcommittee on the Constitution and Civil Justice.|2013-09-13|https://www.congress.gov/113/bills/hres319/BILLS-113hres319ih.pdf
Proposing an amendment to the Constitution of the United States relative to equal rights for men and women.|113|House|CAROLYN MALONEY(D) |Referred to the Subcommittee on the Constitution and Civil Justice.|2013-09-13|https://www.congress.gov/113/bills/hjres56/BILLS-113hjres56ih.pdf
To amend the Missing Children's Assistance Act to better enable law enforcement to identify, locate, and recover child victims of sex trafficking.|113|House|Tim Walberg(R) |Referred to the House Committee on Education and the Workforce.|2013-09-11|https://www.congress.gov/113/bills/hr3081/BILLS-113hr3081ih.pdf
To improve the response to and prevention of sexual assaults involving members of the Armed Forces.|113|House|Kristi Noem(R) |Referred to the Subcommittee on Military Personnel.|2013-08-29|https://www.congress.gov/113/bills/hr2227/BILLS-113hr2227ih.pdf
Expressing support for designation of August 2013 as "Blue Star Mothers of America Month".|113|House|Doug LaMalfa(R) |Referred to the Subcommittee on Military Personnel.|2013-08-29|https://www.congress.gov/113/bills/hres293/BILLS-113hres293ih.pdf
Amending the Rules of the House of Representatives to observe a moment of silence in the House on the first legislative day of each month for those killed or wounded in the United States engagement in Afghanistan.|113|House|WALTER JONES(R) |Referred to the House Committee on Rules.|2013-08-01|https://www.congress.gov/113/bills/hres323/BILLS-113hres323ih.pdf
A resolution designating August 16, 2013, as "National Airborne Day".|113|Senate|John Reed(D) |Submitted in the Senate, considered, and agreed to without amendment and with a preamble by Unanimous Consent. (consideration: CR S6138; text as passed Senate: CR S6131-6132)|2013-07-31|https://www.congress.gov/113/bills/sres207/BILLS-113sres207ats.pdf
Essex National Heritage Area Reauthorization Act|113|Senate|Elizabeth Warren(D) |Committee on Energy and Natural Resources Subcommittee on National Parks. Hearings held. With printed Hearing: S.Hrg. 113-93.|2013-07-31|https://www.congress.gov/113/bills/s1186/BILLS-113s1186is.pdf
Women, Peace, and Security Act of 2013|113|House|JANICE SCHAKOWSKY(D) |Referred to the Committee on Foreign Affairs, and in addition to the Committee on Armed Services, for a period to be subsequently determined by the Speaker, in each case for consideration of such provisions as fall within the jurisdiction of the committee concerned.|2013-07-31|https://www.congress.gov/113/bills/hr2874/BILLS-113hr2874ih.pdf
To reauthorize appropriations for the National Women's Rights History Project Act.|113|House|LOUISE SLAUGHTER(D) |Referred to the Subcommittee on Public Lands and Environmental Regulation.|2013-07-25|https://www.congress.gov/113/bills/hr2763/BILLS-113hr2763ih.pdf
End Sex Trafficking Act of 2013|113|Senate|John Cornyn(R) |Read twice and referred to the Committee on the Judiciary.|2013-07-24|https://www.congress.gov/113/bills/s1354/BILLS-113s1354is.pdf
Authorizing the use of Emancipation Hall in the Capitol Visitor Center for a ceremony honoring the life and legacy of Nelson Mandela on the occasion of the 95th anniversary of his birth.|113|House|MAXINE WATERS(D) |Message on Senate action sent to the House.|2013-07-15|https://www.congress.gov/113/bills/hconres43/BILLS-113hconres43enr.pdf
Essex National Heritage Area Reauthorization Act|113|House|JOHN TIERNEY(D) |Referred to the Subcommittee on Public Lands and Environmental Regulation.|2013-07-09|https://www.congress.gov/113/bills/hr2568/BILLS-113hr2568ih.pdf
Pregnant Workers Fairness Act|113|House|JERROLD NADLER(D) |Referred to the Subcommittee on Workforce Protections.|2013-07-08|https://www.congress.gov/113/bills/hr1975/BILLS-113hr1975ih.pdf
Pregnant and Parenting Students Access to Education Act of 2013|113|House|Jared Polis(D) |Referred to the Subcommittee on Early Childhood, Elementary, and Secondary Education.|2013-07-08|https://www.congress.gov/113/bills/hr1845/BILLS-113hr1845ih.pdf
Improving the Juvenile Justice System for Girls Act of 2013|113|House|ROSA DELAURO(D) |Referred to the Subcommittee on Early Childhood, Elementary, and Secondary Education.|2013-07-08|https://www.congress.gov/113/bills/hr1833/BILLS-113hr1833ih.pdf
To amend title 10, United States Code, to require an Inspector General investigation of allegations of retaliatory personnel actions taken in response to making protected communications regarding sexual assault.|113|House|Jackie Walorski(R) |Received in the Senate and Read twice and referred to the Committee on Armed Services.|2013-07-08|https://www.congress.gov/113/bills/hr1864/BILLS-113hr1864rfs.pdf
A resolution recognizing refugee women and girls on World Refugee Day.|113|Senate|BARBARA BOXER(D) |Submitted in the Senate, considered, and agreed to without amendment and with a preamble by Unanimous Consent. (consideration: CR S5098; text as passed Senate: CR S5027-5028)|2013-06-24|https://www.congress.gov/113/bills/sres184/BILLS-113sres184ats.pdf
Women's Preventive Health Awareness Campaign|113|House|Ami Bera(D) |Referred to the Subcommittee on Health.|2013-06-21|https://www.congress.gov/113/bills/hr2457/BILLS-113hr2457ih.pdf
Combating Military Sexual Assault Act of 2013|113|House|TIM RYAN(D) |Referred to the Subcommittee on Military Personnel.|2013-06-20|https://www.congress.gov/113/bills/hr2002/BILLS-113hr2002ih.pdf
A resolution honoring the men and women of the Drug Enforcement Administration on the occasion of the 40th anniversary of the agency.|113|Senate|Dianne Feinstein(D) |Referred to the Committee on the Judiciary. (text of measure as introduced: CR S4796-4797)|2013-06-20|https://www.congress.gov/113/bills/sres178/BILLS-113sres178is.pdf
Pain-Capable Unborn Child Protection Act|113|House|Trent Franks(R) |Received in the Senate and Read twice and referred to the Committee on the Judiciary.|2013-06-19|https://www.congress.gov/113/bills/hr1797/BILLS-113hr1797rfs.pdf
MOMS for the 21st Century Act|113|House|LUCILLE ROYBAL-ALLARD(D) |Referred to the Subcommittee on Health.|2013-06-19|https://www.congress.gov/113/bills/hr2286/BILLS-113hr2286ih.pdf
Providing for consideration of the bill (H.R. 1947) to provide for the reform and continuation of agricultural and other programs of the Department of Agriculture through fiscal year 2018, and for other purposes; and providing for consideration of the bill (H.R. 1797) to amend title 18, United States Code, to protect pain-capable unborn children in the District of Columbia, and for other purposes.|113|House|Virginia Foxx(R) |Motion to reconsider laid on the table Agreed to without objection.|2013-06-18|https://www.congress.gov/113/bills/hres266/BILLS-113hres266eh.pdf
Stillbirth Awareness and Research Act of 2013|113|House|PETER KING(R) |Referred to the Subcommittee on Health.|2013-06-14|https://www.congress.gov/113/bills/hr2365/BILLS-113hr2365ih.pdf
Expressing the sense of the House of Representatives that Congress and the States should investigate and correct abusive, unsanitary, and illegal abortion practices.|113|House|Stephen Fincher(R) |Referred to the Subcommittee on the Constitution and Civil Justice.|2013-06-14|https://www.congress.gov/113/bills/hres206/BILLS-113hres206ih.pdf
Protect our Native Women Act of 2013|113|House|Kristi Noem(R) |Referred to the Subcommittee on Crime, Terrorism, Homeland Security, and Investigations.|2013-06-14|https://www.congress.gov/113/bills/hr1836/BILLS-113hr1836ih.pdf
Recognizing the importance of United States leadership in addressing the challenge of global maternal and child malnutrition.|113|House|Debbie Wasserman Schultz(D) |Referred to the House Committee on Foreign Affairs.|2013-06-11|https://www.congress.gov/113/bills/hres254/BILLS-113hres254ih.pdf
Veterans Day Moment of Silence Act|113|House|Stephen Lynch(D) |Referred to the Subcommittee on Disability Assistance and Memorial Affairs.|2013-06-11|https://www.congress.gov/113/bills/hr2185/BILLS-113hr2185ih.pdf
Child Sex Trafficking Data and Response Act of 2013|113|Senate|Ron Wyden(D) |Read twice and referred to the Committee on Health, Education, Labor, and Pensions.|2013-06-07|https://www.congress.gov/113/bills/s1118/BILLS-113s1118is.pdf
A bill to amend title 10, United States Code, to require an Inspector General investigation of allegations of retaliatory personnel actions taken in response to making protected communications regarding sexual assault.|113|Senate|Amy Klobuchar(D) |Read twice and referred to the Committee on Armed Services.|2013-06-04|https://www.congress.gov/113/bills/s1092/BILLS-113s1092is.pdf
A bill to provide for offices on sexual assault prevention and response under the Chiefs of Staff of the Armed Forces, to require reports on additional offices and selection of sexual assault prevention and response personnel, and for other purposes.|113|Senate|Jeanne Shaheen(D) |Committee on Armed Services. Hearings held. Hearings printed: S.Hrg. 113-320.|2013-06-04|https://www.congress.gov/113/bills/s992/BILLS-113s992is.pdf
A bill to require a comprehensive review of the adequacy of the training, qualifications, and experience of the Department of Defense personnel responsible for sexual assault prevention and response for the Armed Forces, and for other purposes.|113|Senate|Claire McCaskill(D) |Committee on Armed Services. Hearings held. Hearings printed: S.Hrg. 113-320.|2013-06-04|https://www.congress.gov/113/bills/s964/BILLS-113s964is.pdf
Combating Military Sexual Assault Act of 2013|113|Senate|Patty Murray(D) |Committee on Armed Services. Hearings held. Hearings printed: S.Hrg. 113-320.|2013-06-04|https://www.congress.gov/113/bills/s871/BILLS-113s871is.pdf
Military Sexual Assault Prevention Act of 2013|113|Senate|Amy Klobuchar(D) |Committee on Armed Services. Hearings held. Hearings printed: S.Hrg. 113-320.|2013-06-04|https://www.congress.gov/113/bills/s548/BILLS-113s548is.pdf
Ensuring Women's Access to Free-Market Healthcare Act of 2013|113|House|Bill Cassidy(R) |Referred to the Subcommittee on Health.|2013-06-03|https://www.congress.gov/113/bills/hr1675/BILLS-113hr1675ih.pdf
To award posthumously a Congressional Gold Medal to Addie Mae Collins, Denise McNair, Carole Robertson, and Cynthia Wesley to commemorate the lives they lost 50 years ago in the bombing of the Sixteenth Street Baptist Church, where these 4 little Black girls' ultimate sacrifice served as a catalyst for the Civil Rights Movement.|113|House|Terri Sewell(D) |Became Public Law No: 113-11.|2013-05-24|https://www.congress.gov/113/bills/hr360/BILLS-113hr360enr.pdf
Better Enforcement for Sexual Assault Free Environments Act of 2013|113|Senate|Claire McCaskill(D) |Read twice and referred to the Committee on Armed Services.|2013-05-23|https://www.congress.gov/113/bills/s1032/BILLS-113s1032is.pdf
Stop Deceptive Advertising for Women's Services Act|113|House|CAROLYN MALONEY(D) |Referred to the Subcommittee on Commerce, Manufacturing, and Trade.|2013-05-17|https://www.congress.gov/113/bills/hr2030/BILLS-113hr2030ih.pdf
Access to Certified Professional Midwives Act of 2013|113|House|Chellie Pingree(D) |Referred to the Subcommittee on Health.|2013-05-17|https://www.congress.gov/113/bills/hr1976/BILLS-113hr1976ih.pdf
