A bill to provide Federal financial assistance to States for programs to identify women who received diethylstilbestrol (DES) while pregnant and the children of such women, to establish a voluntary registry of such women and children, to provide screening of such women and children for cancer related to such drug, and to provide information respecting the health hazards of such drug.|98|House|FRANK GUARINI(D) |Referred to Subcommittee on Health and the Environment.|1983-06-01|NA
A bill to amend title XVIII of the Social Security Act to provide for coverage under part B of medicare for routine Papanicolaou tests for the diagnosis of uterine cancer.|98|House|JOHN HAMMERSCHMIDT(R) |Referred to Subcommittee on Health and the Environment.|1983-06-01|NA
A resolution to express the sense of the Senate that the laws which insure equal rights with regard to education opportunity for women should be maintained.|98|Senate|CHRISTOPHER DODD(D) |Referred to Subcommittee on Education.|1983-05-24|NA
A joint resolution proposing an amendment to the Constitution of the United States relating to equal rights for women and men.|98|House|JAMES JEFFORDS(R) |Referred to Subcommittee on Civil and Constitutional Rights.|1983-05-23|NA
A resolution to honor Bob Hope on the occasion of his eightieth birthday.|98|Senate|HENRY JACKSON(D) |Submitted in the Senate, considered, and agreed to without amendment and with a preamble by Voice Vote.|1983-05-17|NA
A bill to amend the Social Security Act to increase the authorization for fiscal year 1984 for maternal and child health services block grant.|98|House|HENRY WAXMAN(D) |Placed on Union Calendar No: 83.|1983-05-16|NA
A concurrent resolution providing for the commemoration of the one hundredth anniversary of the birth of Harry S Truman.|98|Senate|THOMAS EAGLETON(D) |Referred to the Committee on Rules.|1983-05-11|NA
A bill to amend title 38, United States Code, to establish in the Veterans' Administration an Advisory Committee on Women Veterans.|98|House|ROBERT EDGAR(D) |Clean Bill H.R.2920 Forwarded by Subcommittee to Full Committee in Lieu.|1983-05-05|NA
A bill to amend the Immigration and Nationality Act to repeal the provision excluding admission of aliens on the sole ground of sexual deviation.|98|House|JULIAN DIXON(D) |Referred to Subcommittee on Immigration, Refugees, and International Law.|1983-05-03|NA
A bill to amend title 5 of the United States Code to provide payments under Government health plans for services of nurse-midwives.|98|House|BARBARA MIKULSKI(D) |Referred to Subcommittee on Compensation and Employee Benefits.|1983-05-02|NA
A bill to amend title II of the Social Security Act to provide full benefits for disabled widows and widowers without regard to age (and without regard to any previous reduction in their benefits).|98|House|MARY OAKAR(D) |Referred to Subcommittee on Social Security.|1983-04-28|NA
A bill to direct the United States Postal Service to issue a special postage stamp to commemorate the 100th anniversary of the birth of President Harry S Truman.|98|House|IKE SKELTON(D) |Referred to House Committee on Post Office and Civil Service.|1983-04-21|NA
Sexual Exploitation of Children Act of 1983|98|House|EARL HUTTO(D) |Referred to Subcommittee on Crime.|1983-04-11|NA
A joint resolution proposing an amendment to the Constitution relating to equal rights for men and women.|98|House|CLARENCE NELSON(D) |Referred to Subcommittee on Civil and Constitutional Rights.|1983-04-11|NA
A bill to require the head of each Federal administrative and executive agency to conduct a review of agency regulations, to rewrite current regulations with sex-based distinctions, and to refrain from promulgating future regulations which contain gender-based distinctions.|98|House|PATRICIA SCHROEDER(D) |Referred to Subcommittee on Civil and Constitutional Rights.|1983-04-07|NA
A joint resolution proposing an amendment to the Constitution of the United States for the protection of unborn children and other persons.|98|House|ELWOOD HILLIS(R) |Referred to Subcommittee on Civil and Constitutional Rights.|1983-03-30|NA
A bill to amend title 42, United States Code, chapter 7, subchapter II to reduce from 10 to 5 years the length of time a divorced woman's marriage to an insured individual must have lasted in order for her to qualify for wife's or widow's benefits on his wage record.|98|House|SIDNEY YATES(D) |Referred to Subcommittee on Social Security.|1983-03-28|NA
A bill to amend title II of the Social Security Act to provide that surviving divorced wives, as well as widows, may marry after attaining age 60 without affecting their entitlement to widow's insurance benefits.|98|House|ANDREW JACOBS(D) |See H.R.1900.|1983-03-25|NA
A bill to amend title XVIII of the Social Security Act to provide for coverage under part B of Medicare for routine Papanicolaou tests for the diagnosis of uterine cancer.|98|House|CARDISS COLLINS(D) |Referred to Subcommittee on Health and the Environment.|1983-03-16|NA
Domestic Violence Prevention and Services Act|98|Senate|EDWARD KENNEDY(D) |Committee on Labor and Human Resources requested executive comment from Health and Human Services Department, Agriculture Department, Defense Department, HUD, Justice Department, ACTION, Legal Services Corporation, GAO, OMB.|1983-03-14|NA
A bill to amend the Immigration and Nationality Act to provide special preference treatment for certain children born in the Philippines and fathered by American servicemen.|98|House|PHILLIP BURTON(D) |Referred to Subcommittee on Immigration, Refugees, and International Law.|1983-03-14|NA
Domestic Violence Prevention and Services Act|98|House|BARBARA MIKULSKI(D) |Referred to Subcommittee on Select Education.|1983-03-09|NA
A joint resolution providing that the week containing March 8, 1983, shall be designated as "Women's History Week".|98|Senate|ORRIN HATCH(R) |Became Public Law No: 98-3.|1983-03-08|https://www.congress.gov/98/statute/STATUTE-97/STATUTE-97-Pg6.pdf
A joint resolution designating the week beginning March 6, 1983, as "Women's History Week".|98|House|BARBARA MIKULSKI(D) |See S.J.Res.37.|1983-03-08|NA
War Resisters Exoneration Act of 1983|98|House|RONALD DELLUMS(D) |Referred to Subcommittee on Courts, Civil Liberties, and the Administration of Justice.|1983-03-07|NA
A resolution providing for the consideration of the bill (H.R. 1718) making appropriations to provide emergency expenditures to meet neglected urgent needs, to protect and add to the national wealth, resulting in not make-work but productive jobs for women and men and to help provide for the indigent and homeless for the fiscal year 1983, and for other purposes.|98|House|DAVID BONIOR(D) |Resolution Agreed to in House by Yea-Nay Vote: 300 - 103 (Record Vote No: 17).|1983-03-03|NA
A bill to amend the laws of the United States to eliminate gender-based distinctions and for other purposes.|98|House|S. GREEN(R) |Referred to Subcommittee on Civil and Constitutional Rights.|1983-03-03|NA
A bill to require that fifty-dollar bills bear a portrait of Georgia Neese Clark Gray, the first woman to serve as Treasurer of the United States.|98|House|ANDREW JACOBS(D) |Referred to Subcommittee on Consumer Affairs and Coinage.|1983-03-01|NA
A concurrent resolution in commemoration of the bicentennial of the birth of Simon Bolivar, hero of the independence of the Americas.|98|House|DANIEL MICA(D) |Referred to Subcommittee on Census and Population.|1983-02-28|NA
A bill to prohibit employment discrimination on the basis of sexual orientation.|98|Senate|PAUL TSONGAS(D) |Committee on Labor and Human Resources requested executive comment from Labor Department, OMB.|1983-02-22|NA
A joint resolution proposing an amendment to the Constitution of the United States for the protection of unborn children and other persons.|98|Senate|EDWIN GARN(R) |Referred to Subcommittee on Constitution.|1983-02-22|NA
A bill to provide legal protection for unborn human beings and for other purposes.|98|Senate|JESSE HELMS(R) |Referred to Subcommittee on Separation of Powers.|1983-02-22|NA
A bill to designate the birthday of Martin Luther King, Junior, a legal public holiday.|98|House|ROBERT GARCIA(D) |Executive Comment Requested from OPM, OMB.|1983-02-15|NA
A joint resolution to provide for the designation of September 4, 1983, as "Working Mothers' Day".|98|House|CARDISS COLLINS(D) |Referred to Subcommittee on Census and Population.|1983-02-14|NA
Maternal and Child Health Act of 1983|98|Senate|ALAN CRANSTON(D) |Committee on Finance requested executive comment from OMB, Treasury Department, Health and Human Services Department.|1983-02-09|NA
Womens Equal Rights Act of 1983|98|House|KENNETH KRAMER(R) |Referred to Subcommittee on Civil and Constitutional Rights.|1983-02-09|NA
A joint resolution proposing an amendment to the constitution of the United States guaranteeing the right of life to the unborn.|98|House|HENRY HYDE(R) |Referred to Subcommittee on Civil and Constitutional Rights.|1983-02-04|NA
A bill to extinguish Federal court jurisdiction to require attendance at a particular school of any student because of race, color, creed, or sex.|98|House|JOSEPH GAYDOS(D) |Referred to Subcommittee on Courts, Civil Liberties, and the Administration of Justice.|1983-02-04|NA
A bill to amend title XIX of the Social Security Act to extend medicaid eligibility to certain low-income pregnant women and newborn children.|98|Senate|ALAN CRANSTON(D) |Committee on Finance requested executive comment from OMB, Treasury Department, Health and Human Services Department.|1983-02-04|NA
A joint resolution proposing an amendment to the Constitution of the United States to provide that equality of rights under the law shall not be denied or abridged by the United States or by any State on account of sex.|98|House|MARIO BIAGGI(D) |Referred to Subcommittee on Civil and Constitutional Rights.|1983-02-04|NA
A joint resolution proposing an amendment to the Constitution of the United States to provide that equality of rights under the law shall not be denied or abridged by the United States or by any State on account of sex.|98|House|THOMAS KINDNESS(R) |Referred to Subcommittee on Civil and Constitutional Rights.|1983-02-04|NA
A joint resolution to amend the Constitution to establish legislative authority in Congress and States with respect to abortion.|98|House|BILL EMERSON(R) |Referred to Subcommittee on Civil and Constitutional Rights.|1983-02-04|NA
A joint resolution proposing an amendment to the Constitution relating to equal rights for men and women.|98|House|STEPHEN NEAL(D) |Referred to Subcommittee on Civil and Constitutional Rights.|1983-02-04|NA
A joint resolution proposing an amendment to the Constitution relating to equal rights for men and women.|98|House|STEPHEN NEAL(D) |Referred to Subcommittee on Civil and Constitutional Rights.|1983-02-04|NA
A joint resolution proposing an amendment to the Constitution of the United States for the protection of unborn children and other persons.|98|House|GEORGE HANSEN(R) |Referred to Subcommittee on Civil and Constitutional Rights.|1983-02-04|NA
A bill to extinguish Federal court jurisdiction to require attendance at a particular school of any student because of race, color, creed, or sex.|98|House|GEORGE HANSEN(R) |Referred to Subcommittee on Courts, Civil Liberties, and the Administration of Justice.|1983-02-04|NA
A joint resolution proposing an amendment to the Constitution of the United States for the protection of unborn children and for other persons.|98|House|MARTIN RUSSO(D) |Referred to Subcommittee on Civil and Constitutional Rights.|1983-02-04|NA
A bill to designate the birthday of Martin Luther King, Junior, a legal public holiday.|98|House|ROBERT ROE(D) |Referred to Subcommittee on Census and Population.|1983-02-03|NA
A bill to amend the Railroad Retirement Act of 1974 to provide spouses' and widows' benefits to certain divorced persons.|98|House|JOHN DUNCAN(R) |Referred to Subcommittee on Commerce, Transportation and Tourism.|1983-02-02|NA
A bill to amend the Railroad Retirement Act of 1974 to provide that remarried widows who elected a residual lump sum payment may rescind that election, repay the lump sum, and receive an annuity in certain instances.|98|House|JAMES OBERSTAR(D) |Referred to Subcommittee on Commerce, Transportation and Tourism.|1983-02-02|NA
Domestic Violence Prevention and Services Act|98|House|MARIO BIAGGI(D) |Referred to Subcommittee on Select Education.|1983-02-02|NA
A bill to amend the Communications Act of 1934 in order to prohibit the television broadcasting of programs portraying nudity, obscenity, or explicit sexual activity which is offensive to the public taste and morals.|98|House|JOHN HAMMERSCHMIDT(R) |Referred to Subcommittee on Telecommunications, Consumer Protection and Finance.|1983-02-02|NA
A joint resolution acknowledging the Big Brothers/Big Sisters of America for its achievements and recognizing its volunteers for their service to children.|98|House|MARILYN LLOYD(D) |Referred to Subcommittee on Census and Population.|1983-02-02|NA
A bill to amend title X of the Public Health Service Act to provide that grants and contracts may not be made under that title to any entity which provides abortion counseling to minors without the knowledge and consent of their parents or guardians, and for other purposes.|98|House|PHILIP CRANE(R) |Referred to Subcommittee on Health and the Environment.|1983-02-02|NA
A bill to prohibit payment of any Federal funds to or for the benefit of any entity which provides abortion counseling to minors without the consent of their parents or guardians.|98|House|PHILIP CRANE(R) |Referred to Subcommittee on Health and the Environment.|1983-02-02|NA
A bill to provide a remedy for sex discrimination by the insurance business with respect to the availability and scope of insurance coverage for women.|98|House|MARJORIE HOLT(R) |Referred to Subcommittee on Commerce, Transportation and Tourism.|1983-02-02|NA
A bill to designate the birthday of Martin Luther King, Junior, a legal public holiday.|98|Senate|CHARLES MATHIAS(R) |Read twice and referred to the Committee on Judiciary.|1983-02-02|NA
A bill to make eligible for annuities payable under section 4 of Public Law 92-425 (relating to the Armed Forces Survivor Benefit Plan) persons who became widows during the eighteen-month period following the effective date of such law.|98|House|CHARLES BENNETT(D) |Referred to Subcommittee on Military Personnel and Compensation.|1983-02-01|NA
A bill to amend title 5 of the United States Code to provide payments under government health plans for services of nurse-midwives not performed in connection with a physician.|98|Senate|DANIEL INOUYE(D) |Referred to Subcommittee on Civil Service and General Services.|1983-02-01|NA
A resolution urging the United States Postal Service to issue a postage stamp commemorating servicemen and servicewomen of the United States who, as a result of their service to the Nation during a time of military conflict, have been prisoners of wars or have been declared missing in action.|98|House|FRANK GUARINI(D) |Referred to House Committee on Post Office and Civil Service.|1983-01-27|NA
A bill to redesignate the days on which Washington's Birthday, Memorial Day, and Columbus Day are celebrated and to make each day a legal public holiday.|98|Senate|JENNINGS RANDOLPH(D) |Read twice and referred to the Committee on Judiciary.|1983-01-26|NA
Relief of Pain in the Human Fetus During Abortion Act|98|House|NORMAN LENT(R) |Referred to Subcommittee on Social Security.|1983-01-10|NA
