Unborn Child Support Act|116|Senate|Kevin Cramer(R) |Read twice and referred to the Committee on Finance.|2020-01-28|https://www.congress.gov/116/bills/s3236/BILLS-116s3236is.pdf
Recognizing the leading role of Utahns in the fight for women's suffrage and celebrating the sesquicentennial of the first votes by women under the equal suffrage law of Utah on February 14, 1870.|116|House|Rob Bishop(R) |Referred to the Subcommittee on the Constitution, Civil Rights, and Civil Liberties.|2020-01-28|https://www.congress.gov/116/bills/hres804/BILLS-116hres804ih.pdf
Fair Housing for Domestic Violence and Sexual Assault Survivors Act of 2019|116|House|Debbie Wasserman Schultz(D) |Referred to the Subcommittee on Crime, Terrorism, and Homeland Security.|2020-01-28|https://www.congress.gov/116/bills/hr5531/BILLS-116hr5531ih.pdf
A resolution designating January 23, 2020, as "Maternal Health Awareness Day".|116|Senate|Cory Booker(D) |Referred to the Committee on the Judiciary. (text: CR S436-437)|2020-01-21|https://www.congress.gov/116/bills/sres479/BILLS-116sres479is.pdf
Pregnant Women Health and Safety Act of 2020|116|Senate|John Kennedy(R) |Read twice and referred to the Committee on the Judiciary.|2020-01-21|https://www.congress.gov/116/bills/s3226/BILLS-116s3226is.pdf
Data Mapping to Save Moms' Lives Act|116|House|G. K. Butterfield(D) |Referred to the House Committee on Energy and Commerce.|2020-01-16|https://www.congress.gov/116/bills/hr5640/BILLS-116hr5640ih.pdf
A resolution recognizing the importance of sustained United States leadership to accelerating global progress against maternal and child malnutrition and supporting the commitment of the United States Agency for International Development to reducing global malnutrition through the Multi-Sectoral Nutrition Strategy.|116|Senate|Susan Collins(R) |Resolution agreed to in Senate with an amendment and an amendment to the Title and an amended preamble by Unanimous Consent. (consideration: CR S198-199)|2020-01-14|https://www.congress.gov/116/bills/sres260/BILLS-116sres260ats.pdf
To amend title 38, United States Code, to clarify the eligibility of children of Vietnam veterans born with spina bifida for benefits of the Department of Veterans Affairs.|116|House|SANFORD BISHOP(D) |Referred to the Subcommittee on Disability Assistance and Memorial Affairs.|2020-01-14|https://www.congress.gov/116/bills/hr5471/BILLS-116hr5471ih.pdf
Protection of Women and Girls in Sports Act of 2020|116|House|W. Steube(R) |Referred to the House Committee on Education and Labor.|2020-01-14|https://www.congress.gov/116/bills/hr5603/BILLS-116hr5603ih.pdf
PUMP for Nursing Mothers Act|116|House|CAROLYN MALONEY(D) |Referred to the House Committee on Education and Labor.|2020-01-13|https://www.congress.gov/116/bills/hr5592/BILLS-116hr5592ih.pdf
Abortion Is Not Health Care Act of 2020|116|Senate|Mike Lee(R) |Read twice and referred to the Committee on Finance.|2020-01-09|https://www.congress.gov/116/bills/s3173/BILLS-116s3173is.pdf
PUMP for Nursing Mothers Act|116|Senate|Jeff Merkley(D) |Read twice and referred to the Committee on Health, Education, Labor, and Pensions.|2020-01-09|https://www.congress.gov/116/bills/s3170/BILLS-116s3170is.pdf
Supporting the designation of February 1, 2020, as "Blue Star Mother's Day".|116|House|FRED UPTON(R) |Referred to the House Committee on Armed Services.|2020-01-09|https://www.congress.gov/116/bills/hres785/BILLS-116hres785ih.pdf
SAFE SEX Workers Study Act|116|Senate|Elizabeth Warren(D) |Read twice and referred to the Committee on Health, Education, Labor, and Pensions.|2020-01-08|https://www.congress.gov/116/bills/s3165/BILLS-116s3165is.pdf
To repeal the funding authorization sunset and the total funding cap for the Essex National Heritage Area.|116|House|Seth Moulton(D) |Referred to the Subcommittee on National Parks, Forests, and Public Lands.|2020-01-08|https://www.congress.gov/116/bills/hr5441/BILLS-116hr5441ih.pdf
Breastfeeding Mothers Jury Duty Exclusion Act of 2019|116|House|ELEANOR NORTON(D) |Referred to the Subcommittee on Courts, Intellectual Property, and the Internet.|2019-12-19|https://www.congress.gov/116/bills/hr5183/BILLS-116hr5183ih.pdf
Body Armor for Females Modernization Act|116|House|Joe Wilson(R) |Referred to the House Committee on Armed Services.|2019-12-19|https://www.congress.gov/116/bills/hr5491/BILLS-116hr5491ih.pdf
Teleabortion Prevention Act of 2019|116|House|Ron Wright(R) |Referred to the Subcommittee on Crime, Terrorism, and Homeland Security.|2019-12-18|https://www.congress.gov/116/bills/hr4935/BILLS-116hr4935ih.pdf
Down Syndrome Discrimination by Abortion Prohibition Act|116|House|Ron Estes(R) |Referred to the Subcommittee on Crime, Terrorism, and Homeland Security.|2019-12-18|https://www.congress.gov/116/bills/hr4903/BILLS-116hr4903ih.pdf
SAFE SEX Workers Study Act|116|House|Ro Khanna(D) |Referred to the Subcommittee on Health.|2019-12-18|https://www.congress.gov/116/bills/hr5448/BILLS-116hr5448ih.pdf
Supporting the goals of Transgender Day of Remembrance.|116|House|Joseph Kennedy(D) |Referred to the Subcommittee on the Constitution, Civil Rights, and Civil Liberties.|2019-12-18|https://www.congress.gov/116/bills/hres722/BILLS-116hres722ih.pdf
Small Airport Mothers' Rooms Act of 2019|116|House|Carol Miller(R) |Received in the Senate.|2019-12-17|https://www.congress.gov/116/bills/hr3362/BILLS-116hr3362rds.pdf
SAVE Moms and Babies Act of 2019|116|Senate|Cindy Hyde-Smith(R) |Read twice and referred to the Committee on Health, Education, Labor, and Pensions.|2019-12-17|https://www.congress.gov/116/bills/s3072/BILLS-116s3072is.pdf
A bill to provide for an advisory committee for the prevention of sexual misconduct in the Coast Guard, and for other purposes.|116|Senate|Joni Ernst(R) |Read twice and referred to the Committee on Commerce, Science, and Transportation.|2019-12-17|https://www.congress.gov/116/bills/s3066/BILLS-116s3066is.pdf
Fair Housing for Domestic Violence and Sexual Assault Survivors Act of 2019|116|Senate|Jeanne Shaheen(D) |Read twice and referred to the Committee on Banking, Housing, and Urban Affairs.|2019-12-16|https://www.congress.gov/116/bills/s3061/BILLS-116s3061is.pdf
Combat Sexual Harassment in Housing Act|116|Senate|Jeanne Shaheen(D) |Read twice and referred to the Committee on Banking, Housing, and Urban Affairs.|2019-12-16|https://www.congress.gov/116/bills/s3059/BILLS-116s3059is.pdf
International Violence Against Women Act of 2019|116|Senate|Jeanne Shaheen(D) |Read twice and referred to the Committee on Foreign Relations.|2019-12-12|https://www.congress.gov/116/bills/s3037/BILLS-116s3037is.pdf
A resolution congratulating astronauts Dr. Jessica U. Meir and Christina H. Koch for the historic accomplishment of completing the first all-female spacewalk.|116|Senate|Susan Collins(R) |Submitted in the Senate, considered, and agreed to without amendment and with a preamble by Unanimous Consent. (consideration: CR S6956; text: CR S6954)|2019-12-10|https://www.congress.gov/116/bills/sres451/BILLS-116sres451ats.pdf
To provide that the Secretary of Education may not issue or enforce certain rules that weaken the enforcement of the prohibition of sex discrimination applicable under title IX of the Education Amendments of 1972.|116|House|Elissa Slotkin(D) |Referred to the House Committee on Education and Labor.|2019-12-10|https://www.congress.gov/116/bills/hr5388/BILLS-116hr5388ih.pdf
International Violence Against Women Act of 2019|116|House|JANICE SCHAKOWSKY(D) |Referred to the Subcommittee on Africa, Global Health, Global Human Rights, and International Organizations.|2019-12-06|https://www.congress.gov/116/bills/hr5267/BILLS-116hr5267ih.pdf
Federal Funding Accountability for Sexual Harassers Act|116|House|Jackie Speier(D) |Referred to the Committee on Education and Labor, and in addition to the Committees on Oversight and Reform, and Science, Space, and Technology, for a period to be subsequently determined by the Speaker, in each case for consideration of such provisions as fall within the jurisdiction of the committee concerned.|2019-12-05|https://www.congress.gov/116/bills/hr5328/BILLS-116hr5328ih.pdf
Female Body Armor Modernization Act of 2019|116|Senate|Joni Ernst(R) |Read twice and referred to the Committee on Armed Services.|2019-12-03|https://www.congress.gov/116/bills/s2970/BILLS-116s2970is.pdf
Recognizing the maternal health crisis among indigenous women in the United States, which includes American Indian, Alaska Native, and Native Hawaiian women, recognizing the importance of reducing mortality and morbidity among indigenous women, and calling for urgent Federal funding changes to ensure comprehensive, high-quality, and culturally competent maternal health and family planning services are available.|116|House|Debra Haaland(D) |Referred to the Subcommittee for Indigenous Peoples of the United States.|2019-12-02|https://www.congress.gov/116/bills/hres735/BILLS-116hres735ih.pdf
Women's Suffrage Centennial Commemorative Coin Act|116|House|Elise Stefanik(R) |Became Public Law No: 116-71.|2019-11-25|https://www.congress.gov/116/bills/hr2423/BILLS-116hr2423enr.pdf
A bill to reauthorize the Violence Against Women Act of 1994, and for other purposes.|116|Senate|Joni Ernst(R) |Read the second time. Placed on Senate Legislative Calendar under General Orders. Calendar No. 308.|2019-11-21|https://www.congress.gov/116/bills/s2920/BILLS-116s2920pcs.pdf
Supporting Healthy Mothers and Infants Act of 2019|116|House|David Trone(D) |Referred to the House Committee on Education and Labor.|2019-11-21|https://www.congress.gov/116/bills/hr5249/BILLS-116hr5249ih.pdf
Supporting Veteran Survivors of Domestic and Sexual Violence Act of 2019|116|Senate|Jeanne Shaheen(D) |Read twice and referred to the Committee on Veterans' Affairs.|2019-11-20|https://www.congress.gov/116/bills/s2915/BILLS-116s2915is.pdf
Protecting Critical Services for Mothers and Babies Act|116|Senate|Timothy Kaine(D) |Read twice and referred to the Committee on Health, Education, Labor, and Pensions. (Sponsor introductory remarks on measure: CR S6720)|2019-11-20|https://www.congress.gov/116/bills/s2913/BILLS-116s2913is.pdf
Protecting Critical Services for Mothers and Babies Act|116|House|Lucy McBath(D) |Referred to the Committee on Education and Labor, and in addition to the Committee on Ways and Means, for a period to be subsequently determined by the Speaker, in each case for consideration of such provisions as fall within the jurisdiction of the committee concerned.|2019-11-20|https://www.congress.gov/116/bills/hr5202/BILLS-116hr5202ih.pdf
Recognizing the significance of equal pay and the disparity in wages paid to Latina women in comparison to men.|116|House|Debbie Mucarsel-Powell(D) |Referred to the House Committee on Education and Labor.|2019-11-20|https://www.congress.gov/116/bills/hconres76/BILLS-116hconres76ih.pdf
A resolution designating February 1, 2020, as "Blue Star Mother's Day".|116|Senate|Gary Peters(D) |Submitted in the Senate, considered, and agreed to without amendment and with a preamble by Unanimous Consent. (consideration: CR S6679; text: CR S6675)|2019-11-19|https://www.congress.gov/116/bills/sres433/BILLS-116sres433ats.pdf
A resolution designating December 10, 2019, as "Wyoming Women's Suffrage Day".|116|Senate|MICHAEL ENZI(R) |Submitted in the Senate, considered, and agreed to without amendment and with a preamble by Unanimous Consent. (consideration: CR S6679; text: CR S6674)|2019-11-19|https://www.congress.gov/116/bills/sres430/BILLS-116sres430ats.pdf
Promoting Women in Trucking Workforce Act|116|House|Mike Gallagher(R) |Referred to the Subcommittee on Highways and Transit.|2019-11-19|https://www.congress.gov/116/bills/hr5145/BILLS-116hr5145ih.pdf
Homeless Youth Menstrual Product Access Act of 2019|116|House|Joyce Beatty(D) |Referred to the House Committee on Education and Labor.|2019-11-19|https://www.congress.gov/116/bills/hr5177/BILLS-116hr5177ih.pdf
Sexual Assault Victims Protection Act of 2019|116|House|H. Griffith(R) |Referred to the Subcommittee on Crime, Terrorism, and Homeland Security.|2019-11-15|https://www.congress.gov/116/bills/hr4758/BILLS-116hr4758ih.pdf
A resolution recognizing the historical, cultural, and religious significance of the 550th birthday of Guru Nanak and the contributions and sacrifices made by Sikhs of the United States.|116|Senate|Todd Young(R) |Resolution agreed to in Senate without amendment and with a preamble by Unanimous Consent. (text: CR 10/31/2019 S6339)|2019-11-14|https://www.congress.gov/116/bills/sres393/BILLS-116sres393ats.pdf
A resolution expressing the sense of the Senate that the United States Postal Service should issue a commemorative postage stamp series honoring women veterans of the Armed Forces and that the Citizens' Stamp Advisory Committee should recommend to the Postmaster General that such a stamp series be issued.|116|Senate|Elizabeth Warren(D) |Resolution agreed to in Senate without amendment and with a preamble by Unanimous Consent. (text: CR 11/07/2019 S6482)|2019-11-14|https://www.congress.gov/116/bills/sres415/BILLS-116sres415ats.pdf
Promoting Women in Trucking Workforce Act|116|Senate|Jerry Moran(R) |Read twice and referred to the Committee on Commerce, Science, and Transportation.|2019-11-14|https://www.congress.gov/116/bills/s2858/BILLS-116s2858is.pdf
Supporting the designation of December 10, 2019, as "Wyoming Women's Suffrage Day".|116|House|Liz Cheney(R) |Referred to the House Committee on Oversight and Reform.|2019-11-14|https://www.congress.gov/116/bills/hres700/BILLS-116hres700ih.pdf
Violence Against Women Reauthorization Act of 2019|116|Senate|Dianne Feinstein(D) |Read twice and referred to the Committee on the Judiciary. (Sponsor introductory remarks on measure: CR S6569)|2019-11-13|https://www.congress.gov/116/bills/s2843/BILLS-116s2843is.pdf
Women in Apprenticeship and Nontraditional Occupations Amendment Act|116|House|Marc Veasey(D) |Sponsor introductory remarks on measure. (CR H8789)|2019-11-13|https://www.congress.gov/116/bills/hr4933/BILLS-116hr4933ih.pdf
Recognizing the significance of the 550th birth anniversary of Guru Nanak, the founder of Sikhism, to Sikh Americans and Sikhs worldwide.|116|House|John Garamendi(D) |Referred to the House Committee on Oversight and Reform.|2019-11-12|https://www.congress.gov/116/bills/hres689/BILLS-116hres689ih.pdf
Recognizing 25 years since the 1994 International Conference on Population and Development (ICPD) in Cairo, Egypt and reaffirming the goals and ideals of the ICPD Programme of Action, including comprehensive sexual and reproductive health and rights.|116|House|Lois Frankel(D) |Referred to the House Committee on Foreign Affairs.|2019-11-12|https://www.congress.gov/116/bills/hres688/BILLS-116hres688ih.pdf
Recognizing the historical, cultural, and religious significance of the 550th birthday of Guru Nanak and the contributions and sacrifices made by Sikhs of the United States.|116|House|Greg Pence(R) |Referred to the House Committee on Oversight and Reform.|2019-11-08|https://www.congress.gov/116/bills/hres680/BILLS-116hres680ih.pdf
A resolution recognizing October 2019 as "National Women's Small Business Month".|116|Senate|Marco Rubio(R) |Submitted in the Senate, considered, and agreed to without amendment and with a preamble by Unanimous Consent. (consideration: CR S6357; text: CR S6342)|2019-10-31|https://www.congress.gov/116/bills/sres400/BILLS-116sres400ats.pdf
Girls LEAD Act|116|Senate|Susan Collins(R) |Read twice and referred to the Committee on Foreign Relations. (Sponsor introductory remarks on measure: CR S6338)|2019-10-31|https://www.congress.gov/116/bills/s2766/BILLS-116s2766is.pdf
Expressing appreciation during "National Domestic Violence Awareness Month" to all providers working tirelessly to educate communities, provide shelter and assistance to victims, and end the scourge of domestic violence.|116|House|RICK LARSEN(D) |Referred to the House Committee on Education and Labor.|2019-10-31|https://www.congress.gov/116/bills/hres673/BILLS-116hres673ih.pdf
A resolution supporting the goals and ideals of National Domestic Violence Awareness Month, commending domestic violence victim advocates, domestic violence victim service providers, crisis hotline staff, and first responders serving victims of domestic violence for their compassionate support of survivors of domestic violence, and expressing the sense of the Senate that Congress should continue to support efforts to end domestic violence, provide safety for victims of domestic violence and their families, and hold perpetrators of domestic violence accountable.|116|Senate|Dianne Feinstein(D) |Referred to the Committee on the Judiciary. (text: CR S6304-6305)|2019-10-30|https://www.congress.gov/116/bills/sres387/BILLS-116sres387is.pdf
Down Syndrome Discrimination by Abortion Prohibition Act|116|Senate|Jim Inhofe(R) |Read twice and referred to the Committee on the Judiciary.|2019-10-30|https://www.congress.gov/116/bills/s2745/BILLS-116s2745is.pdf
Original National Domestic Violence Awareness Month Resolution of 2019|116|House|Al Green(D) |Referred to the House Committee on Education and Labor.|2019-10-30|https://www.congress.gov/116/bills/hres664/BILLS-116hres664ih.pdf
Domestic Violence Records Reporting Improvement Act of 2019|116|House|Kathleen Rice(D) |Referred to the Subcommittee on Crime, Terrorism, and Homeland Security.|2019-10-28|https://www.congress.gov/116/bills/hr4600/BILLS-116hr4600ih.pdf
Home Visiting to Reduce Maternal Mortality and Morbidity Act|116|House|DANNY DAVIS(D) |Referred to the Subcommittee on Health.|2019-10-22|https://www.congress.gov/116/bills/hr4768/BILLS-116hr4768ih.pdf
Women's Business Centers Improvements Act of 2019|116|House|Sharice Davids(D) |Received in the Senate and Read twice and referred to the Committee on Small Business and Entrepreneurship.|2019-10-22|https://www.congress.gov/116/bills/hr4405/BILLS-116hr4405rfs.pdf
Recognizing women's cardiovascular health as a critical health care priority that affects every State and contributes to increased health care costs, and promoting the necessity of increased awareness of and education on the symptoms for heart disease among women, gender-specific cardiovascular disease research, and policy action to alleviate the risks of heart disease among women.|116|House|Jaime Herrera Beutler(R) |Referred to the Subcommittee on Health.|2019-10-21|https://www.congress.gov/116/bills/hres643/BILLS-116hres643ih.pdf
Transgender Military Service Reporting Act of 2019|116|House|Anthony Brown(D) |Referred to the Subcommittee on Military Personnel.|2019-10-21|https://www.congress.gov/116/bills/hr4746/BILLS-116hr4746ih.pdf
Expressing support for the designation of October 11, 2019, as the Day of the Girl Child in the United States, and celebrating the International Day of the Girl Child in the United States.|116|House|David Trone(D) |Referred to the House Committee on Education and Labor.|2019-10-18|https://www.congress.gov/116/bills/hres645/BILLS-116hres645ih.pdf
Pregnancy Discrimination Amendment Act|116|House|Tim Walberg(R) |Referred to the House Committee on Education and Labor.|2019-10-18|https://www.congress.gov/116/bills/hr4738/BILLS-116hr4738ih.pdf
A resolution congratulating the Washington Mystics on winning the 2019 Women's National Basketball Association championship.|116|Senate|Chris Van Hollen(D) |Submitted in the Senate, considered, and agreed to without amendment and with a preamble by Unanimous Consent. (consideration: CR S5905; text: CR S5902-5903)|2019-10-17|https://www.congress.gov/116/bills/sres364/BILLS-116sres364ats.pdf
HEAL for Immigrant Women and Families Act of 2019|116|House|Pramila Jayapal(D) |Referred to the Subcommittee on Health.|2019-10-17|https://www.congress.gov/116/bills/hr4701/BILLS-116hr4701ih.pdf
Congratulating the Washington Mystics on winning the 2019 Women's National Basketball Association championship.|116|House|ELEANOR NORTON(D) |Referred to the House Committee on Oversight and Reform.|2019-10-17|https://www.congress.gov/116/bills/hres638/BILLS-116hres638ih.pdf
National Commission to Combat Workplace Sexual Harassment Act|116|House|ELEANOR NORTON(D) |Referred to the House Committee on Education and Labor.|2019-10-11|https://www.congress.gov/116/bills/hr4660/BILLS-116hr4660ih.pdf
Commemorating the 150th anniversary of the birth of Mohandas Karamchand Gandhi.|116|House|Raja Krishnamoorthi(D) |Referred to the Subcommittee on Asia, the Pacific and Nonproliferation.|2019-10-08|https://www.congress.gov/116/bills/hres595/BILLS-116hres595ih.pdf
Afghan Women’s Inclusion in Negotiations Act|116|House|William Keating(D) |Referred to the Subcommittee on Asia, the Pacific and Nonproliferation.|2019-10-08|https://www.congress.gov/116/bills/hr4097/BILLS-116hr4097ih.pdf
Condemning Secretary Ben Carson's bigoted comments regarding transgender people and decrying the Department of Housing and Urban Development's continued effort, under Secretary Carson's leadership, to single out and discriminate against LGBTQ individuals.|116|House|Mike Quigley(D) |Referred to the House Committee on Financial Services.|2019-10-01|https://www.congress.gov/116/bills/hres613/BILLS-116hres613ih.pdf
Interagency Committee on Women’s Business Enterprise Act of 2019|116|House|Grace Meng(D) |Referred to the House Committee on Small Business.|2019-09-27|https://www.congress.gov/116/bills/hr4569/BILLS-116hr4569ih.pdf
To amend title 38, United States Code, to direct the Secretary of Veterans Affairs to establish and implement a comprehensive anti-harassment and anti-sexual assault policy of the Department of Veterans Affairs.|116|House|Julia Brownley(D) |Referred to the House Committee on Veterans' Affairs.|2019-09-27|https://www.congress.gov/116/bills/hr4554/BILLS-116hr4554ih.pdf
Women and Minorities in STEM Booster Act of 2019|116|Senate|Mazie Hirono(D) |Read twice and referred to the Committee on Health, Education, Labor, and Pensions.|2019-09-26|https://www.congress.gov/116/bills/s2578/BILLS-116s2578is.pdf
A resolution celebrating the 150th anniversary of the birth of Mahatma Gandhi.|116|Senate|Robert Menendez(D) |Referred to the Committee on the Judiciary. (text: CR S5757)|2019-09-26|https://www.congress.gov/116/bills/sres357/BILLS-116sres357is.pdf
Ensuring Accurate and Complete Abortion Data Reporting Act of 2019|116|Senate|Joni Ernst(R) |Read twice and referred to the Committee on Finance.|2019-09-26|https://www.congress.gov/116/bills/s2585/BILLS-116s2585is.pdf
MOM Act|116|Senate|Martha McSally(R) |Read twice and referred to the Committee on Health, Education, Labor, and Pensions.|2019-09-26|https://www.congress.gov/116/bills/s2586/BILLS-116s2586is.pdf
Expressing support for the designation of September 2019 as National Campus Sexual Assault Awareness Month.|116|House|ELEANOR NORTON(D) |Referred to the House Committee on Oversight and Reform.|2019-09-26|https://www.congress.gov/116/bills/hres600/BILLS-116hres600ih.pdf
Women and Minorities in STEM Booster Act of 2019|116|House|CAROLYN MALONEY(D) |Referred to the House Committee on Science, Space, and Technology.|2019-09-26|https://www.congress.gov/116/bills/hr4528/BILLS-116hr4528ih.pdf
Expressing the sense of the House of Representatives regarding the relationships between firearm violence, misogyny, and violence against women and reaffirming the importance of preventing individuals with a history of violence against women from accessing a firearm.|116|House|Jackie Speier(D) |Referred to the Subcommittee on Crime, Terrorism, and Homeland Security.|2019-09-25|https://www.congress.gov/116/bills/hres555/BILLS-116hres555ih.pdf
Expressing the sense of the Congress that a commemorative postage stamp series should be issued honoring women veterans, and that the Citizens' Stamp Advisory Committee should recommend to the Postmaster General that such a stamp series be issued.|116|House|Julia Brownley(D) |Referred to the House Committee on Oversight and Reform.|2019-09-24|https://www.congress.gov/116/bills/hres579/BILLS-116hres579ih.pdf
Expressing support for the designation of September 23 as "Mary Church Terrell Day", and calling on Congress to recognize Mary Church Terrell's lasting contributions to the civil rights and women's rights movements.|116|House|ELEANOR NORTON(D) |Referred to the House Committee on Oversight and Reform.|2019-09-24|https://www.congress.gov/116/bills/hres583/BILLS-116hres583ih.pdf
To require the Commodity Futures Trading Commission to establish an Office of Minority and Women Inclusion, and for other purposes.|116|House|David Scott(D) |Referred to the Subcommittee on Commodity Exchanges, Energy, and Credit.|2019-09-24|https://www.congress.gov/116/bills/hr4257/BILLS-116hr4257ih.pdf
SAVE Moms and Babies Act of 2019|116|House|Robert Latta(R) |Referred to the Subcommittee on Health.|2019-09-20|https://www.congress.gov/116/bills/hr4399/BILLS-116hr4399ih.pdf
Improving Oversight of Women Veterans’ Care Act of 2019|116|House|J. Correa(D) |Subcommittee Hearings Held.|2019-09-11|https://www.congress.gov/116/bills/hr4096/BILLS-116hr4096ih.pdf
Violence Against Women Veterans Act|116|House|NYDIA VELAZQUEZ(D) |Subcommittee Hearings Held.|2019-09-11|https://www.congress.gov/116/bills/hr3867/BILLS-116hr3867ih.pdf
VA Newborn Emergency Treatment Act|116|House|Colin Allred(D) |Subcommittee Hearings Held.|2019-09-11|https://www.congress.gov/116/bills/hr2752/BILLS-116hr2752ih.pdf
Women Veterans Health Care Accountability Act|116|House|Joe Cunningham(D) |Subcommittee Hearings Held.|2019-09-11|https://www.congress.gov/116/bills/hr2982/BILLS-116hr2982ih.pdf
To direct the Secretary of Veterans Affairs to submit to Congress a report on the availability of prosthetic items for women veterans from the Department of Veterans Affairs.|116|House|Chris Pappas(D) |Subcommittee Hearings Held.|2019-09-11|https://www.congress.gov/116/bills/hr2681/BILLS-116hr2681ih.pdf
