Unborn Children's Civil Rights Act|106|Senate|JESSE HELMS(R) |Read the second time. Placed on Senate Legislative Calendar under General Orders. Calendar No. 1.|1999-01-20|https://www.congress.gov/106/bills/s40/BILLS-106s40pcs.pdf
Violence Against Women Act of 1999|106|Senate|ORRIN HATCH(R) |Read twice and referred to the Committee on Judiciary.|1999-01-19|https://www.congress.gov/106/bills/s245/BILLS-106s245is.pdf
A bill to amend title V of the Social Securtiy Act to increase the authorization of appropriations for the maternal and child health services block grant and to promote integrated physical and specialized mental health services for children and adolescents.|106|Senate|DANIEL MOYNIHAN(D) |Read twice and referred to the Committee on Finance.|1999-01-19|https://www.congress.gov/106/bills/s207/BILLS-106s207is.pdf
Domestic Violence Identification and Referral Act of 1999|106|Senate|BARBARA BOXER(D) |Read twice and referred to the Committee on HELP.|1999-01-19|https://www.congress.gov/106/bills/s198/BILLS-106s198is.pdf
Violence Against Women Act II|106|Senate|JOSEPH BIDEN(D) |Read twice and referred to the Committee on Judiciary.|1999-01-19|https://www.congress.gov/106/bills/s51/BILLS-106s51is.pdf
Women's Pension Protection Act of 1999|106|Senate|Olympia Snowe(R) |Read twice and referred to the Committee on Finance.|1999-01-19|https://www.congress.gov/106/bills/s132/BILLS-106s132is.pdf
Women's Health and Cancer Rights Act of 1999|106|Senate|Olympia Snowe(R) |Read twice and referred to the Committee on HELP.|1999-01-19|https://www.congress.gov/106/bills/s115/BILLS-106s115is.pdf
Empowering Women Business Owners Act|106|House|JUANITA MILLENDER-MCDONALD(D) |Referred to the House Committee on Small Business.|1999-01-19|https://www.congress.gov/106/bills/hr392/BILLS-106hr392ih.pdf
Women's Investment and Savings Equity Act of 1999|106|House|BILL MCCOLLUM(R) |Sponsor introductory remarks on measure. (CR E46)|1999-01-07|https://www.congress.gov/106/bills/hr189/BILLS-106hr189ih.pdf
