Expressing support for the designation of the week of April 11 through April 17, 2022, as the fifth annual "Black Maternal Health Week" to bring national attention to the maternal health crisis in the United States and the importance of reducing maternal mortality and morbidity among Black women and birthing persons.|117|House|Alma Adams(D) |Referred to the Subcommittee on Nutrition, Oversight, and Department Operations.|2022-04-18|https://www.congress.gov/117/bills/hres1051/BILLS-117hres1051ih.pdf
Recognizing linemen, the profession of linemen, the contributions of these brave men and women who protect public safety, and expressing support for the designation of April 18, 2022, as National Lineman Appreciation Day.|117|House|David Rouzer(R) |Referred to the Subcommittee on Energy.|2022-04-15|https://www.congress.gov/117/bills/hres1059/BILLS-117hres1059ih.pdf
Condemning the rape and assault of women by Russian forces in the occupied area of Bucha, Ukraine, and calling on Vladimir Putin and the Russian Federation to remove all Russian forces from Ukraine, and to cease all hostilities, protect human rights, and allow the free flow of aid.|117|House|MARCY KAPTUR(D) |Referred to the House Committee on Foreign Affairs.|2022-04-14|https://www.congress.gov/117/bills/hres1057/BILLS-117hres1057ih.pdf
A resolution recognizing the designation of the week of April 11 through April 17, 2022, as the fifth annual "Black Maternal Health Week" to bring national attention to the maternal health crisis in the United States and the importance of reducing maternal mortality and morbidity among Black women and birthing persons.|117|Senate|Cory Booker(D) |Referred to the Committee on Health, Education, Labor, and Pensions. (text: CR S2099-2100)|2022-04-07|https://www.congress.gov/117/bills/sres590/BILLS-117sres590is.pdf
Addressing the hardships and disparities faced by Black women in order to encourage more inclusive policymaking.|117|House|Bonnie Watson Coleman(D) |Referred to the House Committee on Oversight and Reform.|2022-04-07|https://www.congress.gov/117/bills/hres1050/BILLS-117hres1050ih.pdf
Data Mapping to Save Moms’ Lives Act|117|House|G. K. Butterfield(D) |Received in the Senate. Read twice. Placed on Senate Legislative Calendar under General Orders. Calendar No. 340.|2022-04-06|https://www.congress.gov/117/bills/hr1218/BILLS-117hr1218pcs.pdf
Women in Criminal Justice Reform Act|117|House|Karen Bass(D) |Referred to the Subcommittee on Health.|2022-04-06|https://www.congress.gov/117/bills/hr7394/BILLS-117hr7394ih.pdf
A concurrent resolution supporting the goals and ideals of International Transgender Day of Visibility.|117|Senate|Brian Schatz(D) |Referred to the Committee on the Judiciary.|2022-03-31|https://www.congress.gov/117/bills/sconres35/BILLS-117sconres35is.pdf
Supporting the goals and ideals of International Transgender Day of Visibility.|117|House|Jennifer Wexton(D) |Referred to the House Committee on the Judiciary.|2022-03-31|https://www.congress.gov/117/bills/hconres84/BILLS-117hconres84ih.pdf
Gender Equity in College Sports Commission Act|117|House|CAROLYN MALONEY(D) |Referred to the House Committee on Education and Labor.|2022-03-31|https://www.congress.gov/117/bills/hr7336/BILLS-117hr7336ih.pdf
Recognizing and honoring Emma Weyant as the rightful winner of the 2022 NCAA Division I Women's 500-Yard Freestyle.|117|House|Lauren Boebert(R) |Referred to the House Committee on Education and Labor.|2022-03-30|https://www.congress.gov/117/bills/hres1016/BILLS-117hres1016ih.pdf
Pregnant Students’ Rights Act|117|House|Ashley Hinson(R) |Referred to the House Committee on Education and Labor.|2022-03-30|https://www.congress.gov/117/bills/hr7294/BILLS-117hr7294ih.pdf
A resolution designating March 24, 2022, as "National Women in Agriculture Day".|117|Senate|Joni Ernst(R) |Submitted in the Senate, considered, and agreed to without amendment and with a preamble by Unanimous Consent. (consideration: CR S1839; text: CR S1836-1837)|2022-03-29|https://www.congress.gov/117/bills/sres562/BILLS-117sres562ats.pdf
A resolution recognizing the significance of endometriosis as an unmet chronic disease for women and designating March 2022 as "Endometriosis Awareness Month".|117|Senate|Tammy Duckworth(D) |Referred to the Committee on the Judiciary. (text: CR S1835-1836)|2022-03-29|https://www.congress.gov/117/bills/sres560/BILLS-117sres560is.pdf
Congratulating the Glenville State University women's basketball team for winning the National Collegiate Athletic Association Division II Women's Basketball Championship at the Birmingham CrossPlex in Birmingham, Alabama.|117|House|David McKinley(R) |Referred to the House Committee on Education and Labor.|2022-03-29|https://www.congress.gov/117/bills/hres1014/BILLS-117hres1014ih.pdf
Recognizing and celebrating the 200th anniversary of the birth of Frederick Law Olmsted.|117|House|J. Hill(R) |Referred to the House Committee on Oversight and Reform.|2022-03-29|https://www.congress.gov/117/bills/hres1013/BILLS-117hres1013ih.pdf
Supporting the goals and ideals of National Women's History Month.|117|House|MIKE THOMPSON(D) |Referred to the House Committee on Oversight and Reform.|2022-03-28|https://www.congress.gov/117/bills/hres1008/BILLS-117hres1008ih.pdf
GIRLS STEM Act|117|House|Jerry McNerney(D) |Referred to the House Committee on Education and Labor.|2022-03-28|https://www.congress.gov/117/bills/hr7251/BILLS-117hr7251ih.pdf
A resolution commemorating the 90th birthday of former Mayor of Atlanta, ambassador, and congressional representative Andrew Jackson Young and recognizing the contributions of Andrew Jackson Young to civil and human rights and his work to uplift Georgia.|117|Senate|Raphael Warnock(D) |Referred to the Committee on the Judiciary.|2022-03-24|https://www.congress.gov/117/bills/sres556/BILLS-117sres556is.pdf
Expressing support for the designation of March 24, 2022, as "National Women in Agriculture Day".|117|House|Angie Craig(D) |Referred to the House Committee on Agriculture.|2022-03-24|https://www.congress.gov/117/bills/hres1001/BILLS-117hres1001ih.pdf
A resolution recognizing the heritage, culture, and contributions of American Indian, Alaska Native, and Native Hawaiian women in the United States.|117|Senate|Lisa Murkowski(R) |Submitted in the Senate, considered, and agreed to without amendment and with a preamble by Unanimous Consent. (consideration: CR S1715; text: CR S1291-1292)|2022-03-22|https://www.congress.gov/117/bills/sres555/BILLS-117sres555ats.pdf
Empowering Women in Small Business Act|117|Senate|Joni Ernst(R) |Read twice and referred to the Committee on Small Business and Entrepreneurship.|2022-03-22|https://www.congress.gov/117/bills/s3896/BILLS-117s3896is.pdf
Protecting Girls with Turner Syndrome Act of 2022|117|House|Randy Feenstra(R) |Referred to the House Committee on the Judiciary.|2022-03-21|https://www.congress.gov/117/bills/hr7179/BILLS-117hr7179ih.pdf
Commemorating the life and legacy of Jean-Louis de Kérouac on the centennial of his birth on March 12, 2022.|117|House|Lori Trahan(D) |Referred to the House Committee on Oversight and Reform.|2022-03-11|https://www.congress.gov/117/bills/hres977/BILLS-117hres977ih.pdf
Recognizing Girl Scouts of the United States of America on its 110th birthday and celebrating its legacy of providing girls with a safe, inclusive space while supporting the next generation of women leaders.|117|House|Bonnie Watson Coleman(D) |Referred to the House Committee on Oversight and Reform.|2022-03-11|https://www.congress.gov/117/bills/hres978/BILLS-117hres978ih.pdf
A resolution recognizing Girl Scouts of the United States of America on its 110th birthday and celebrating its legacy of providing girls with a safe, inclusive space that supports the next generation of women leaders.|117|Senate|Tammy Duckworth(D) |Referred to the Committee on the Judiciary. (text: CR S1123-1124)|2022-03-10|https://www.congress.gov/117/bills/sres542/BILLS-117sres542is.pdf
A resolution commemorating the life and legacy of Jean-Louis de Kerouac on the centennial of his birth on March 12, 2022.|117|Senate|Edward Markey(D) |Referred to the Committee on the Judiciary. (text: CR S1123)|2022-03-10|https://www.congress.gov/117/bills/sres541/BILLS-117sres541is.pdf
Maternal and Child Health Stillbirth Prevention Act of 2022|117|Senate|Jeff Merkley(D) |Read twice and referred to the Committee on Finance.|2022-03-10|https://www.congress.gov/117/bills/s3797/BILLS-117s3797is.pdf
Ultrasound Informed Consent Act|117|Senate|Roger Marshall(R) |Read twice and referred to the Committee on Health, Education, Labor, and Pensions.|2022-03-10|https://www.congress.gov/117/bills/s3790/BILLS-117s3790is.pdf
Supporting the goals and ideals of National Women and Girls HIV/AIDS Awareness Day.|117|House|BARBARA LEE(D) |Referred to the Subcommittee on Health.|2022-03-10|https://www.congress.gov/117/bills/hres974/BILLS-117hres974ih.pdf
Maternal and Child Health Stillbirth Prevention Act of 2022|117|House|Alma Adams(D) |Referred to the Subcommittee on Health.|2022-03-10|https://www.congress.gov/117/bills/hr7011/BILLS-117hr7011ih.pdf
Expressing support for the recognition of March 10, 2022, as "Abortion Provider Appreciation Day".|117|House|Andy Levin(D) |Referred to the Subcommittee on Health.|2022-03-09|https://www.congress.gov/117/bills/hconres78/BILLS-117hconres78ih.pdf
Fair Social Security for Domestic Violence Survivors Act|117|House|Antonio Delgado(D) |Referred to the House Committee on Ways and Means.|2022-03-09|https://www.congress.gov/117/bills/hr7020/BILLS-117hr7020ih.pdf
A concurrent resolution expressing support for the recognition of March 10, 2022, as "Abortion Provider Appreciation Day".|117|Senate|Mazie Hirono(D) |Referred to the Committee on Health, Education, Labor, and Pensions. (text: CR S1064-1065)|2022-03-08|https://www.congress.gov/117/bills/sconres32/BILLS-117sconres32is.pdf
Women and Climate Change Act of 2022|117|Senate|Mazie Hirono(D) |Read twice and referred to the Committee on Foreign Relations. (Sponsor introductory remarks on measure: CR S1061)|2022-03-08|https://www.congress.gov/117/bills/s3774/BILLS-117s3774is.pdf
Expressing the sense of the House of Representatives that corporations should commit to utilizing the benefits of gender diversity in boards of directors and other senior management positions.|117|House|Donald Beyer(D) |Referred to the House Committee on Education and Labor.|2022-03-08|https://www.congress.gov/117/bills/hres971/BILLS-117hres971ih.pdf
A resolution designating March 2022 as "National Women's History Month".|117|Senate|Dianne Feinstein(D) |Submitted in the Senate, considered, and agreed to without amendment and with a preamble by Unanimous Consent. (consideration: CR S1013-1014; text: CR S1019)|2022-03-07|https://www.congress.gov/117/bills/sres537/BILLS-117sres537ats.pdf
Data Mapping to Save Moms' Lives Act|117|Senate|Jacklyn Rosen(D) |Held at the desk.|2022-03-07|https://www.congress.gov/117/bills/s198/BILLS-117s198es.pdf
SAFE SEX Workers Study Act|117|House|Ro Khanna(D) |Referred to the Subcommittee on Health.|2022-03-04|https://www.congress.gov/117/bills/hr6928/BILLS-117hr6928ih.pdf
Ending Forced Arbitration of Sexual Assault and Sexual Harassment Act of 2021|117|House|Cheri Bustos(D) |Became Public Law No: 117-90.|2022-03-03|https://www.congress.gov/117/bills/hr4445/BILLS-117hr4445enr.pdf
SAFE SEX Workers Study Act|117|Senate|Elizabeth Warren(D) |Read twice and referred to the Committee on the Judiciary.|2022-03-03|https://www.congress.gov/117/bills/s3758/BILLS-117s3758is.pdf
Supporting United States bids to host the Men's and Women's Rugby World Cup tournaments.|117|House|Alexander Mooney(R) |Referred to the House Committee on Foreign Affairs.|2022-03-03|https://www.congress.gov/117/bills/hconres77/BILLS-117hconres77ih.pdf
Supporting the goals and ideals of the International Day for the Elimination of Violence against Women.|117|House|Andre Carson(D) |Referred to the Committee on Foreign Affairs, and in addition to the Committee on the Judiciary, for a period to be subsequently determined by the Speaker, in each case for consideration of such provisions as fall within the jurisdiction of the committee concerned.|2022-03-01|https://www.congress.gov/117/bills/hres957/BILLS-117hres957ih.pdf
Reproductive Choice Act|117|Senate|Susan Collins(R) |Read twice and referred to the Committee on the Judiciary. (Sponsor introductory remarks on measure: CR S838)|2022-02-28|https://www.congress.gov/117/bills/s3713/BILLS-117s3713is.pdf
Women's Health Protection Act of 2021|117|House|Judy Chu(D) |Cloture on the motion to proceed to the measure not invoked in Senate by Yea-Nay Vote. 46 - 48. Record Vote Number: 65. (CR S826)|2022-02-28|https://www.congress.gov/117/bills/hr3755/BILLS-117hr3755pcs.pdf
No Pro-Abortion Task Force Act|117|House|Andy Biggs(R) |Referred to the Subcommittee on Health.|2022-02-28|https://www.congress.gov/117/bills/hr6828/BILLS-117hr6828ih.pdf
Supporting women's cardiovascular health.|117|House|Lori Trahan(D) |Referred to the Subcommittee on Health.|2022-02-28|https://www.congress.gov/117/bills/hres946/BILLS-117hres946ih.pdf
Celebrating the first anniversary of the coalition of signatory countries to the Geneva Consensus Declaration on Promoting Women's Health and Strengthening the Family.|117|House|Jim Banks(R) |Referred to the Subcommittee on International Development, International Organizations and Global Corporate Social Impact.|2022-02-22|https://www.congress.gov/117/bills/hconres57/BILLS-117hconres57ih.pdf
Condemning the sexual and gender-based violence against women and girls in Ethiopia and emphasizing the urgent demand for humanitarian responses to meet their needs.|117|House|Jackie Speier(D) |Referred to the Subcommittee on Africa, Global Health, and Global Human Rights.|2022-02-22|https://www.congress.gov/117/bills/hres842/BILLS-117hres842ih.pdf
Preventing Violence Against Female Inmates Act of 2022|117|House|Eric Crawford(R) |Referred to the House Committee on the Judiciary.|2022-02-18|https://www.congress.gov/117/bills/hr6764/BILLS-117hr6764ih.pdf
A resolution recognizing the growing threats against women and children, religious and ethnic minorities, and LGBTQI persons in Afghanistan and against allies of such individuals, such as civil society leaders and activists, scholars, former government officials, journalists, and media workers, and expressing solidarity with and reaffirming the dire need to protect vulnerable and minority populations and their allies in Afghanistan under Taliban rule.|117|Senate|Edward Markey(D) |Referred to the Committee on Foreign Relations.|2022-02-15|https://www.congress.gov/117/bills/sres513/BILLS-117sres513is.pdf
Recognizing the growing threats against women and children, religious and ethnic minorities, and LGBTQI persons in Afghanistan and against allies of such individuals, such as civil society leaders and activists, scholars, former government officials, journalists, and media workers, and expressing solidarity with and reaffirming the dire need to protect vulnerable and minority populations and their allies in Afghanistan under Taliban rule.|117|House|Andre Carson(D) |Referred to the House Committee on Foreign Affairs.|2022-02-15|https://www.congress.gov/117/bills/hres926/BILLS-117hres926ih.pdf
Directing the Joint Committee on the Library to revise the statue commemorating women's suffrage which is located in the rotunda of the United States Capitol, commonly known as the "Portrait Monument", by placing on the statue an inscription which is based on the original inscription which was on the statue when the statue was delivered to the United States Capitol in 1921, and for other purposes.|117|House|CAROLYN MALONEY(D) |Referred to the House Committee on House Administration.|2022-02-15|https://www.congress.gov/117/bills/hconres72/BILLS-117hconres72ih.pdf
Safeguarding Women’s and Children’s Health Act of 2022|117|House|Jackie Walorski(R) |Referred to the Subcommittee on Health.|2022-02-10|https://www.congress.gov/117/bills/hr6702/BILLS-117hr6702ih.pdf
Violence Against Women Act Reauthorization Act of 2022|117|Senate|Dianne Feinstein(D) |Read the second time. Placed on Senate Legislative Calendar under General Orders. Calendar No. 268.|2022-02-10|https://www.congress.gov/117/bills/s3623/BILLS-117s3623pcs.pdf
A resolution designating February 1, 2022, as "Blue Star Mother's Day".|117|Senate|Gary Peters(D) |Submitted in the Senate, considered, and agreed to without amendment and with a preamble by Unanimous Consent. (consideration: CR S577; text: CR S577)|2022-02-08|https://www.congress.gov/117/bills/sres507/BILLS-117sres507ats.pdf
Advancing Maternal Health Equity Under Medicaid Act|117|House|Kathy Manning(D) |Referred to the Subcommittee on Health.|2022-02-07|https://www.congress.gov/117/bills/hr6612/BILLS-117hr6612ih.pdf
Providing for consideration of the bill (H.R. 3485) to impose sanctions on foreign persons responsible for violations of internationally recognized human rights against lesbian, gay, bisexual, transgender, queer and intersex (LGBTQI) individuals, and for other purposes; providing for consideration of the bill (H.R. 4445) to amend title 9 of the United States Code with respect to arbitration of disputes involving sexual assault and sexual harassment; providing for consideration of the bill (H.R. 4521) to provide for a coordinated Federal research initiative to ensure continued United States leadership in engineering biology; and for other purposes.|117|House|Deborah Ross(D) |Motion to reconsider laid on the table Agreed to without objection.|2022-02-02|https://www.congress.gov/117/bills/hres900/BILLS-117hres900rh.pdf
A resolution acknowledging and commemorating the World War II women in the Navy who served in the Women Accepted for Volunteer Emergency Service ("WAVES").|117|Senate|Elizabeth Warren(D) |Submitted in the Senate, considered, and agreed to without amendment and with a preamble by Unanimous Consent. (consideration: CR S456, S461; text: CR S447)|2022-02-01|https://www.congress.gov/117/bills/sres502/BILLS-117sres502ats.pdf
Expressing the sense of the House of Representatives that any giant panda born in the United States should belong to the United States and the United States should seek the coordination of its allies to establish collaborative giant panda breeding programs.|117|House|Nancy Mace(R) |Referred to the House Committee on Foreign Affairs.|2022-02-01|https://www.congress.gov/117/bills/hres897/BILLS-117hres897ih.pdf
Child Tax Credit for Pregnant Moms Act of 2022|117|Senate|Steve Daines(R) |Read twice and referred to the Committee on Finance.|2022-01-31|https://www.congress.gov/117/bills/s3537/BILLS-117s3537is.pdf
Child Tax Credit for Pregnant Moms Act of 2022|117|House|Jason Smith(R) |Referred to the Subcommittee on Health.|2022-01-26|https://www.congress.gov/117/bills/hr6505/BILLS-117hr6505ih.pdf
A resolution congratulating the University of Wisconsin-Eau Claire Blugolds on winning the 2021 National Collegiate Athletic Association Division III Women's Volleyball Championship.|117|Senate|Tammy Baldwin(D) |Resolution agreed to in Senate without amendment and with a preamble by Unanimous Consent. (consideration: CR S386; text: 01/12/2022 CR S192-193)|2022-01-20|https://www.congress.gov/117/bills/sres488/BILLS-117sres488es.pdf
A resolution congratulating the University of Wisconsin Badgers on winning the 2021 National Collegiate Athletic Association Division I Women's Volleyball Championship.|117|Senate|Tammy Baldwin(D) |Resolution agreed to in Senate without amendment and with a preamble by Unanimous Consent. (consideration: CR S386; text: 01/12/2022 CR S192)|2022-01-20|https://www.congress.gov/117/bills/sres487/BILLS-117sres487es.pdf
A resolution memorializing the unborn by lowering the United States flag to half-staff on the 22nd day of January each year.|117|Senate|Mike Braun(R) |Referred to the Committee on the Judiciary. (text: CR S383)|2022-01-20|https://www.congress.gov/117/bills/sres494/BILLS-117sres494is.pdf
Supporting the designation of July 2022 as Uterine Fibroids Awareness Month.|117|House|David Scott(D) |Referred to the Subcommittee on Health.|2022-01-20|https://www.congress.gov/117/bills/hres879/BILLS-117hres879ih.pdf
A resolution designating January 23, 2022, as "Maternal Health Awareness Day".|117|Senate|Cory Booker(D) |Referred to the Committee on the Judiciary. (text: CR S352)|2022-01-19|https://www.congress.gov/117/bills/sres492/BILLS-117sres492is.pdf
Sex Trafficking Demand Reduction Act|117|House|Ann Wagner(R) |Referred to the House Committee on Foreign Affairs.|2022-01-18|https://www.congress.gov/117/bills/hr6420/BILLS-117hr6420ih.pdf
Ensuring Accurate and Complete Abortion Data Reporting Act of 2022|117|Senate|Joni Ernst(R) |Read twice and referred to the Committee on Finance.|2022-01-13|https://www.congress.gov/117/bills/s3500/BILLS-117s3500is.pdf
Preventing Violence Against Female Inmates Act of 2022|117|Senate|Tom Cotton(R) |Read twice and referred to the Committee on the Judiciary.|2022-01-12|https://www.congress.gov/117/bills/s3481/BILLS-117s3481is.pdf
Stopping Abortion Bounties Act|117|House|Lizzie Fletcher(D) |Referred to the House Committee on Ways and Means.|2021-12-16|https://www.congress.gov/117/bills/hr6300/BILLS-117hr6300ih.pdf
Protect Black Women and Girls Act of 2021|117|House|Robin Kelly(D) |Referred to the Subcommittee on Health.|2021-12-15|https://www.congress.gov/117/bills/hr6268/BILLS-117hr6268ih.pdf
Recognizing the maternal health crisis among indigenous women in the United States, which includes American Indian, Alaska Native, and Native Hawaiian women, recognizing the importance of reducing mortality and morbidity among indigenous women, and calling for urgent Federal funding changes to ensure comprehensive, high-quality, and culturally competent maternal health and family planning services are available.|117|House|Angie Craig(D) |Referred to the Subcommittee for Indigenous Peoples of the United States.|2021-12-14|https://www.congress.gov/117/bills/hres846/BILLS-117hres846ih.pdf
Improving Coordination for Healthy Moms Act|117|Senate|Raphael Warnock(D) |Read twice and referred to the Committee on Health, Education, Labor, and Pensions.|2021-12-09|https://www.congress.gov/117/bills/s3362/BILLS-117s3362is.pdf
A bill to authorize the use of the rotunda of the Capitol for the lying in state of the remains of the last Medal of Honor recipient of World War II, in order to honor the Greatest Generation and the more than 16,000,000 men and women who served in the Armed Forces of the United States from 1941 to 1945.|117|Senate|Joseph Manchin(D) |Read twice and referred to the Committee on Rules and Administration.|2021-12-09|https://www.congress.gov/117/bills/s3358/BILLS-117s3358is.pdf
 A resolution demanding that the Communist Party of China prove that Peng Shuai is free from censorship, coercion, and intimidation and fully investigate the sexual assault allegations against former Vice Premier Zhang Gaoli.|117|Senate|Rick Scott(R) |Referred to the Committee on Foreign Relations. (text: CR S9048-9049)|2021-12-08|https://www.congress.gov/117/bills/sres474/BILLS-117sres474is.pdf
Justice for Native Survivors of Sexual Violence Act|117|Senate|Tina Smith(D) |Read twice and referred to the Committee on Indian Affairs.|2021-12-07|https://www.congress.gov/117/bills/s3328/BILLS-117s3328is.pdf
Honoring the life and legacy of Congresswoman Carrie Pittman Meek and commending her for her devotion to the Nation and its ideals.|117|House|Frederica Wilson(D) |Referred to the House Committee on House Administration.|2021-12-02|https://www.congress.gov/117/bills/hres834/BILLS-117hres834ih.pdf
Maternal Vaccination Act|117|House|Terri Sewell(D) |Received in the Senate and Read twice and referred to the Committee on Health, Education, Labor, and Pensions.|2021-12-01|https://www.congress.gov/117/bills/hr951/BILLS-117hr951rfs.pdf
Congratulating the Washington Spirit on winning the 2021 National Women's Soccer League championship.|117|House|ELEANOR NORTON(D) |Referred to the House Committee on Oversight and Reform.|2021-12-01|https://www.congress.gov/117/bills/hres828/BILLS-117hres828ih.pdf
Recognizing the Unborn Act of 2021|117|House|Doug Lamborn(R) |Referred to the House Committee on the Judiciary.|2021-12-01|https://www.congress.gov/117/bills/hr6099/BILLS-117hr6099ih.pdf
Protecting Moms Who Served Act of 2021|117|Senate|Tammy Duckworth(D) |Became Public Law No: 117-69.|2021-11-30|https://www.congress.gov/117/bills/s796/BILLS-117s796enr.pdf
Helping with Equal Access to Leave and Investing in Needs for Grieving Mothers and Fathers Act|117|House|Ashley Hinson(R) |Referred to the Subcommittee on Health.|2021-11-19|https://www.congress.gov/117/bills/hr6031/BILLS-117hr6031ih.pdf
HEALING Mothers and Fathers Act|117|Senate|Tom Cotton(R) |Read twice and referred to the Committee on Finance.|2021-11-18|https://www.congress.gov/117/bills/s3253/BILLS-117s3253is.pdf
Healthy MOM Act|117|Senate|Sherrod Brown(D) |Read twice and referred to the Committee on Finance.|2021-11-18|https://www.congress.gov/117/bills/s3239/BILLS-117s3239is.pdf
Access to Birth Control Act|117|House|CAROLYN MALONEY(D) |Referred to the Subcommittee on Health.|2021-11-18|https://www.congress.gov/117/bills/hr6005/BILLS-117hr6005ih.pdf
Pregnancy Loss Mental Health Research Act of 2021|117|House|Tom Emmer(R) |Referred to the Subcommittee on Health.|2021-11-18|https://www.congress.gov/117/bills/hr5995/BILLS-117hr5995ih.pdf
Supporting the goals and principles of Transgender Day of Remembrance of memorializing the lives lost this year to antitransgender violence.|117|House|Marie Newman(D) |Referred to the House Committee on the Judiciary.|2021-11-18|https://www.congress.gov/117/bills/hres814/BILLS-117hres814ih.pdf
