Birth Certificate Enhancement Act of 2011|112|House|Steve Cohen(D) |Referred to the Subcommittee on Health.|2011-02-18|https://www.congress.gov/112/bills/hr666/BILLS-112hr666ih.pdf
No Parole for Sex Offenders Act|112|House|Ben Chandler(D) |Referred to the Subcommittee on Crime, Terrorism, and Homeland Security.|2011-02-14|https://www.congress.gov/112/bills/hr578/BILLS-112hr578ih.pdf
Safety From Sex Offenders Act of 2011|112|Senate|Charles Schumer(D) |Read twice and referred to the Committee on the Judiciary.|2011-02-14|https://www.congress.gov/112/bills/s329/BILLS-112s329is.pdf
Expressing the support of the House of Representatives for efforts to increase diversity in science, technology, engineering, and mathematics (STEM) and recognizing the Association for Women in Science (AWIS) for its 40 years of service to broadening the participation of underrepresented groups in STEM.|112|House|EDDIE JOHNSON(D) |Referred to the House Committee on Science, Space, and Technology.|2011-02-14|https://www.congress.gov/112/bills/hres91/BILLS-112hres91ih.pdf
Recognizing the 75th birthday of the Honorable Barbara Charline Jordan, American politician, leader of the Civil Rights movement, first African-American elected to the Texas Senate, first Southern black woman ever elected to the United States House of Representatives, inspirational figure in the Progressive movement, and recipient of the Presidential Medal of Freedom Award.|112|House|SHEILA JACKSON LEE(D) |Referred to the House Committee on House Administration.|2011-02-11|https://www.congress.gov/112/bills/hres90/BILLS-112hres90ih.pdf
Susan B. Anthony Birthday Act|112|House|CAROLYN MALONEY(D) |Referred to the House Committee on Oversight and Government Reform.|2011-02-11|https://www.congress.gov/112/bills/hr655/BILLS-112hr655ih.pdf
Unborn Child Pain Awareness Act of 2011|112|Senate|Mike Johanns(R) |Read twice and referred to the Committee on Health, Education, Labor, and Pensions.|2011-02-10|https://www.congress.gov/112/bills/s314/BILLS-112s314is.pdf
A resolution celebrating February 2, 2011, as the 25th anniversary of "National Women and Girls in Sports Day".|112|Senate|Olympia Snowe(R) |Resolution agreed to in Senate without amendment and with a preamble by Unanimous Consent. (text: CR S492)|2011-02-02|https://www.congress.gov/112/bills/sres30/BILLS-112sres30ats.pdf
Justice for Survivors of Sexual Assault Act of 2011|112|Senate|Al Franken(D) |Read twice and referred to the Committee on the Judiciary.|2011-02-01|https://www.congress.gov/112/bills/s254/BILLS-112s254is.pdf
A bill to establish a commission to ensure a suitable observance of the centennial of World War I, and to designate memorials to the service of men and women of the United States in World War I.|112|Senate|JAY ROCKEFELLER(D) |Read twice and referred to the Committee on the Judiciary.|2011-02-01|https://www.congress.gov/112/bills/s253/BILLS-112s253is.pdf
Expressing the sense of the House of Representatives with respect to pregnancy resource centers.|112|House|CLIFF STEARNS(R) |Referred to the Subcommittee on Health.|2011-02-01|https://www.congress.gov/112/bills/hres18/BILLS-112hres18ih.pdf
Expressing the sense of the House of Representatives that the Commissioner of Food and Drugs should evaluate the scientific evidence on the question of whether to add more folic acid to enriched grain products and expand folic acid fortification into cornmeal and corn-based food products to help prevent further serious birth defects.|112|House|PETE SESSIONS(R) |Referred to the Subcommittee on Health.|2011-02-01|https://www.congress.gov/112/bills/hres17/BILLS-112hres17ih.pdf
Abortion Non-Discrimination Act of 2011|112|House|John Fleming(R) |Referred to the Subcommittee on Health.|2011-02-01|https://www.congress.gov/112/bills/hr361/BILLS-112hr361ih.pdf
Medicaid Newborn Coverage Act of 2011|112|House|JOSE SERRANO(D) |Referred to the Subcommittee on Health.|2011-02-01|https://www.congress.gov/112/bills/hr351/BILLS-112hr351ih.pdf
Title X Abortion Provider Prohibition Act|112|House|MIKE PENCE(R) |Referred to the Subcommittee on Health.|2011-02-01|https://www.congress.gov/112/bills/hr217/BILLS-112hr217ih.pdf
Abortion Non-Discrimination Act of 2011|112|Senate|David Vitter(R) |Read twice and referred to the Committee on Health, Education, Labor, and Pensions.|2011-01-25|https://www.congress.gov/112/bills/s165/BILLS-112s165is.pdf
Pregnant Women Health and Safety Act|112|Senate|David Vitter(R) |Read twice and referred to the Committee on Health, Education, Labor, and Pensions.|2011-01-25|https://www.congress.gov/112/bills/s121/BILLS-112s121is.pdf
Protecting Pregnant Women and Children From Hexavalent Chromium Act of 2011|112|Senate|BARBARA BOXER(D) |Read twice and referred to the Committee on Environment and Public Works.|2011-01-25|https://www.congress.gov/112/bills/s79/BILLS-112s79is.pdf
Protecting Pregnant Women and Children From Perchlorate Act of 2011|112|Senate|BARBARA BOXER(D) |Read twice and referred to the Committee on Environment and Public Works.|2011-01-25|https://www.congress.gov/112/bills/s78/BILLS-112s78is.pdf
Birthright Citizenship Act of 2011|112|House|Steve King(R) |Referred to the Subcommittee on Immigration Policy and Enforcement.|2011-01-24|https://www.congress.gov/112/bills/hr140/BILLS-112hr140ih.pdf
Celebrating the life of President Ronald Wilson Reagan on the 100th anniversary of his birth.|112|House|Trent Franks(R) |Referred to the House Committee on Oversight and Government Reform.|2011-01-19|https://www.congress.gov/112/bills/hres40/BILLS-112hres40ih.pdf
A resolution honoring Senator Barbara Mikulski for becoming the longest-serving female Senator in history.|112|Senate|HARRY REID(D) |Submitted in the Senate, considered, and agreed to without amendment and with a preamble by Unanimous Consent. (consideration: CR S6-13; text as passed Senate: CR S6-7; text of measure as introduced: CR S64)|2011-01-05|https://www.congress.gov/112/bills/sres4/BILLS-112sres4ats.pdf
