Expressing the sense of the House of Representatives regarding the need for State legislatures to pass comprehensive sexual assault kit reforms.|117|House|David Joyce(R) |Referred to the House Committee on the Judiciary.|2022-11-22|https://www.congress.gov/117/bills/hres1492/BILLS-117hres1492ih.pdf
A concurrent resolution expressing support for the Geneva Consensus Declaration on Promoting Women's Health and Strengthening the Family and urging that the United States be added as a signatory.|117|Senate|Steve Daines(R) |Referred to the Committee on Foreign Relations. (text: CR S6786-6787)|2022-11-17|https://www.congress.gov/117/bills/sconres49/BILLS-117sconres49is.pdf
A bill to amend the Child Nutrition Act of 1966 to require the authorization of frozen fruits and vegetables under the special supplemental nutrition program for women, infants, and children.|117|Senate|Roger Marshall(R) |Read twice and referred to the Committee on Agriculture, Nutrition, and Forestry.|2022-11-17|https://www.congress.gov/117/bills/s5116/BILLS-117s5116is.pdf
A bill to make a technical amendment to the Violence Against Women Act of 1994, and for other purposes.|117|Senate|Mazie Hirono(D) |Introduced in the Senate, read twice, considered, read the third time, and passed without amendment by Unanimous Consent. (consideration: CR S6762-6763; text: CR S6762)|2022-11-17|https://www.congress.gov/117/bills/s7/BILLS-117s7es.pdf
Expressing support for the Geneva Consensus Declaration on Promoting Women's Health and Strengthening the Family and urging that the United States be added as a signatory.|117|House|Jim Banks(R) |Referred to the House Committee on Foreign Affairs.|2022-11-17|https://www.congress.gov/117/bills/hconres115/BILLS-117hconres115ih.pdf
Supporting the goals and principles of Transgender Day of Remembrance by recognizing the epidemic of violence toward transgender people and memorializing the lives lost this year.|117|House|Marie Newman(D) |Referred to the House Committee on the Judiciary.|2022-11-17|https://www.congress.gov/117/bills/hres1488/BILLS-117hres1488ih.pdf
A resolution supporting the goals and ideals of National Domestic Violence Awareness Month.|117|Senate|Dianne Feinstein(D) |Resolution agreed to in Senate without amendment and with a preamble by Voice Vote. (consideration: CR S6747; text: 10/11/2022 CR S6473-6474)|2022-11-16|https://www.congress.gov/117/bills/sres827/BILLS-117sres827ats.pdf
Of inquiry requesting the President and directing the Secretary of Defense to transmit to the House of Representatives any record created on or after January 21, 2021, under the control of the President or the Secretary, respectively, that refers to the Department of Defense and includes certain terms and phrases relating to gender.|117|House|Andrew Clyde(R) |Referred to the House Committee on Armed Services.|2022-11-16|https://www.congress.gov/117/bills/hres1475/BILLS-117hres1475ih.pdf
Providing for consideration of the bill (S. 4524) to limit the judicial enforceability of predispute nondisclosure and nondisparagement contract clauses relating to disputes involving sexual assault and sexual harassment; and for other purposes.|117|House|Mary Scanlon(D) |Motion to reconsider laid on the table Agreed to without objection.|2022-11-15|https://www.congress.gov/117/bills/hres1464/BILLS-117hres1464eh.pdf
The Jackie Walorski Maternal and Child Home Visiting Reauthorization Act of 2022|117|House|DANNY DAVIS(D) |House Committee on Energy and Commerce Granted an extension for further consideration ending not later than Nov. 30, 2022.|2022-11-15|https://www.congress.gov/117/bills/hr8876/BILLS-117hr8876ih.pdf
To authorize the location of a monument on the National Mall to commemorate and honor the women's suffrage movement and the passage of the 19th Amendment to the Constitution, and for other purposes.|117|House|Joe Neguse(D) |Referred to the House Committee on Natural Resources.|2022-11-03|https://www.congress.gov/117/bills/hr9268/BILLS-117hr9268ih.pdf
Menstrual Equity For All Act of 2021|117|House|Grace Meng(D) |Referred to the Subcommittee on Crime, Terrorism, and Homeland Security.|2022-11-01|https://www.congress.gov/117/bills/hr3614/BILLS-117hr3614ih.pdf
Abortion Care Awareness Act of 2022|117|House|CAROLYN MALONEY(D) |Referred to the House Committee on Energy and Commerce.|2022-10-28|https://www.congress.gov/117/bills/hr9247/BILLS-117hr9247ih.pdf
Original National Domestic Violence Awareness Month Resolution of 2022|117|House|Al Green(D) |Referred to the House Committee on Education and Labor.|2022-10-28|https://www.congress.gov/117/bills/hres1451/BILLS-117hres1451ih.pdf
HHS Reproductive and Sexual Health Ombuds Act of 2022|117|House|Nikema Williams(D) |Referred to the House Committee on Energy and Commerce.|2022-10-28|https://www.congress.gov/117/bills/hr9254/BILLS-117hr9254ih.pdf
Supporting Women COPS Act of 2022|117|House|Deborah Ross(D) |Referred to the House Committee on the Judiciary.|2022-10-25|https://www.congress.gov/117/bills/hr9235/BILLS-117hr9235ih.pdf
Recognizing and commemorating the 100th anniversary of the birth of His Holiness Pramukh Swami Maharaj, the spiritual leader of the BAPS Swaminarayan Sanstha.|117|House|Andrew Garbarino(R) |Referred to the House Committee on Oversight and Reform.|2022-10-25|https://www.congress.gov/117/bills/hres1447/BILLS-117hres1447ih.pdf
Condemning the Kingdom of Saudi Arabia's inhumane treatment of Salma al-Shehab and other women's rights defenders.|117|House|Jackie Speier(D) |Referred to the House Committee on Foreign Affairs.|2022-10-21|https://www.congress.gov/117/bills/hres1444/BILLS-117hres1444ih.pdf
Caring for Mothers Act of 2022|117|House|Beth Van Duyne(R) |Referred to the House Committee on Energy and Commerce.|2022-10-21|https://www.congress.gov/117/bills/hr9222/BILLS-117hr9222ih.pdf
INFO for Reproductive Care Act of 2022|117|House|Lori Trahan(D) |Referred to the House Committee on Energy and Commerce.|2022-10-21|https://www.congress.gov/117/bills/hr9220/BILLS-117hr9220ih.pdf
Women Who Worked on the Home Front World War II Memorial Act|117|House|ELEANOR NORTON(D) |Placed on Senate Legislative Calendar under General Orders. Calendar No. 540.|2022-10-18|https://www.congress.gov/117/bills/hr3531/BILLS-117hr3531rs.pdf
To prohibit the use of Federal funds to develop, implement, facilitate, or fund any sexually-oriented program, event, or literature for children under the age of 10, and for other purposes.|117|House|Mike Johnson(R) |Referred to the Committee on Oversight and Reform, and in addition to the Committee on Education and Labor, for a period to be subsequently determined by the Speaker, in each case for consideration of such provisions as fall within the jurisdiction of the committee concerned.|2022-10-18|NA
Reaffirming the preemptive authority of the Federal Food, Drug, and Cosmetic Act (21 U.S.C. 301 et seq.) and the Public Health Service Act (42 U.S.C. 201 et seq.) (including regulations thereunder) with respect to State laws that inhibit access to or use of any reproductive health product.|117|House|Mondaire Jones(D) |Referred to the Committee on Energy and Commerce, and in addition to the Committee on the Judiciary, for a period to be subsequently determined by the Speaker, in each case for consideration of such provisions as fall within the jurisdiction of the committee concerned.|2022-10-14|https://www.congress.gov/117/bills/hres1434/BILLS-117hres1434ih.pdf
To amend title 38, United States Code, to provide for the retroactive payment of benefits for veterans with covered mental health conditions based on military sexual trauma, and for other purposes.|117|House|Salud Carbajal(D) |Referred to the House Committee on Veterans' Affairs.|2022-10-11|NA
Safe Leave for Victims of Domestic Violence Act|117|House|Stephanie Bice(R) |Referred to the Committee on Education and Labor, and in addition to the Committees on Oversight and Reform, and House Administration, for a period to be subsequently determined by the Speaker, in each case for consideration of such provisions as fall within the jurisdiction of the committee concerned.|2022-10-04|https://www.congress.gov/117/bills/hr9125/BILLS-117hr9125ih.pdf
Recognizing the roles and the contributions of United States certified nurse-midwives and certified midwives in providing high-quality, evidence-based, and cost-effective health care services to women and childbearing families.|117|House|LUCILLE ROYBAL-ALLARD(D) |Referred to the House Committee on Energy and Commerce.|2022-09-30|https://www.congress.gov/117/bills/hres1419/BILLS-117hres1419ih.pdf
Expressing the sense of the House of Representatives that the United States Postal Service should issue a commemorative postage stamp honoring Lewis Howard Latimer, in recognition of his distinctive life, scientific achievements, and his civic contributions to technological advancement, to commemorate the upcoming 175th year anniversary of his birth and that the Citizens' Stamp Advisory Committee should recommend to the Postmaster General that such a stamp be issued.|117|House|Grace Meng(D) |Referred to the House Committee on Oversight and Reform.|2022-09-30|https://www.congress.gov/117/bills/hres1417/BILLS-117hres1417ih.pdf
Expressing the sense of Congress that a commemorative postage stamp should be issued in honor of Ava Gardner on her 100th birthday.|117|House|David Rouzer(R) |Referred to the House Committee on Oversight and Reform.|2022-09-30|https://www.congress.gov/117/bills/hconres111/BILLS-117hconres111ih.pdf
A concurrent resolution recognizing the significance of equal pay and the disparity in wages paid to men as compared to wages paid to Black women.|117|Senate|Raphael Warnock(D) |Referred to the Committee on Health, Education, Labor, and Pensions. (text: CR S5561-5562)|2022-09-29|https://www.congress.gov/117/bills/sconres48/BILLS-117sconres48is.pdf
A concurrent resolution commending the bravery, courage, and resolve of the women and men of Iran demonstrating in more than 80 cities and risking their safety to speak out against the Iranian regime's human rights abuses.|117|Senate|Robert Menendez(D) |Referred to the Committee on Foreign Relations. (text: CR S5561)|2022-09-29|https://www.congress.gov/117/bills/sconres47/BILLS-117sconres47is.pdf
Commending the bravery, courage, and resolve of the women and men of Iran demonstrating in more than 80 cities and risking their safety to speak out against the Iranian regime's human rights abuses.|117|House|Claudia Tenney(R) |Referred to the Subcommittee on Middle East, North Africa and Global Counterterrorism.|2022-09-29|https://www.congress.gov/117/bills/hconres110/BILLS-117hconres110ih.pdf
Protecting the Health and Wellness of Babies and Pregnant Women in Custody Act|117|Senate|Amy Klobuchar(D) |Read twice and referred to the Committee on the Judiciary.|2022-09-29|https://www.congress.gov/117/bills/s5027/BILLS-117s5027is.pdf
Healthy Moms and Babies Act|117|Senate|Charles Grassley(R) |Read twice and referred to the Committee on Finance.|2022-09-29|https://www.congress.gov/117/bills/s5015/BILLS-117s5015is.pdf
Reproductive Health Care Accessibility Act|117|House|Cori Bush(D) |Referred to the House Committee on Energy and Commerce.|2022-09-29|https://www.congress.gov/117/bills/hr9040/BILLS-117hr9040ih.pdf
A resolution commending and congratulating the Las Vegas Aces basketball team on winning the 2022 Women's National Basketball Association championship.|117|Senate|Catherine Cortez Masto(D) |Submitted in the Senate, considered, and agreed to without amendment and with a preamble by Unanimous Consent. (consideration: CR S5164-5165; text: CR S5231)|2022-09-28|https://www.congress.gov/117/bills/sres806/BILLS-117sres806ats.pdf
A resolution condemning the detention and death of Mahsa Amini and calling on the Government of Iran to end its systemic persecution of women.|117|Senate|Christopher Coons(D) |Referred to the Committee on Foreign Relations. (text: CR S5230)|2022-09-28|https://www.congress.gov/117/bills/sres803/BILLS-117sres803is.pdf
Sexual Abuse Services in Detention Act|117|Senate|Brian Schatz(D) |Read twice and referred to the Committee on the Judiciary.|2022-09-28|https://www.congress.gov/117/bills/s4979/BILLS-117s4979is.pdf
A bill to require the Secretary of the Army to establish sex-neutral high fitness standards for combat Military Occupational Specialties (MOSs).|117|Senate|Joni Ernst(R) |Read twice and referred to the Committee on Armed Services.|2022-09-27|https://www.congress.gov/117/bills/s4957/BILLS-117s4957is.pdf
Protecting Reproductive Freedom Act|117|House|Patrick Ryan(D) |Referred to the House Committee on Energy and Commerce.|2022-09-22|https://www.congress.gov/117/bills/hr8976/BILLS-117hr8976ih.pdf
Recognizing the significance of equal pay and the disparity in wages paid to men and to Black women.|117|House|Alma Adams(D) |Referred to the House Committee on Education and Labor.|2022-09-22|https://www.congress.gov/117/bills/hconres108/BILLS-117hconres108ih.pdf
Acknowledging and commemorating the World War II women in the Navy who served in the Women Accepted for Volunteer Emergency Service ("WAVES").|117|House|Elaine Luria(D) |Referred to the House Committee on Armed Services.|2022-09-22|https://www.congress.gov/117/bills/hres1388/BILLS-117hres1388ih.pdf
Recognizing September 22nd, 2022, as the Order of the Sons and Daughters of Italy in America, Colombo-Stella Lodge 1149 Day.|117|House|Jim Costa(D) |Referred to the House Committee on Oversight and Reform.|2022-09-22|https://www.congress.gov/117/bills/hres1385/BILLS-117hres1385ih.pdf
Expressing support for the designation of September 23, 2022, as "Mary Church Terrell Day", and calling on Congress to recognize Mary Church Terrell's lasting contributions to the civil rights and women's rights movements.|117|House|ELEANOR NORTON(D) |Referred to the House Committee on Oversight and Reform.|2022-09-21|https://www.congress.gov/117/bills/hres1381/BILLS-117hres1381ih.pdf
A resolution recognizing the history of women's professional baseball in Indiana.|117|Senate|Mike Braun(R) |Referred to the Committee on Commerce, Science, and Transportation. (text: CR S4865)|2022-09-20|https://www.congress.gov/117/bills/sres786/BILLS-117sres786is.pdf
Access to Reproductive Care for Servicemembers Act|117|House|Jason Crow(D) |Referred to the House Committee on Armed Services.|2022-09-20|https://www.congress.gov/117/bills/hr8916/BILLS-117hr8916ih.pdf
Congratulating the Las Vegas Aces for winning the 2022 Women's National Basketball Association Finals.|117|House|Dina Titus(D) |Referred to the House Committee on Oversight and Reform.|2022-09-20|https://www.congress.gov/117/bills/hres1374/BILLS-117hres1374ih.pdf
Protect Pregnancy Care Centers Act of 2022|117|House|CHRISTOPHER SMITH(R) |Referred to the House Committee on the Judiciary.|2022-09-20|https://www.congress.gov/117/bills/hr8926/BILLS-117hr8926ih.pdf
A resolution supporting the designation of September 19, 2022, as "National Stillbirth Prevention Day", recognizing tens of thousands of American families that have endured a stillbirth, and seizing the opportunity to keep other families from experiencing the same tragedy.|117|Senate|Jeff Merkley(D) |Referred to the Committee on Health, Education, Labor, and Pensions. (text: CR S4824)|2022-09-19|https://www.congress.gov/117/bills/sres771/BILLS-117sres771is.pdf
Supporting the designation of September 19, 2022, as "National Stillbirth Prevention Day", recognizing tens of thousands of American families that have endured a stillbirth, and seizing the opportunity to keep other families from experiencing the same tragedy.|117|House|Alma Adams(D) |Referred to the House Committee on Energy and Commerce.|2022-09-19|https://www.congress.gov/117/bills/hres1363/BILLS-117hres1363ih.pdf
Eliminating Limits to Justice for Child Sex Abuse Victims Act of 2022|117|Senate|Richard Durbin(D) |Became Public Law No: 117-176.|2022-09-16|https://www.congress.gov/117/bills/s3103/BILLS-117s3103enr.pdf
Women’s Business Centers Improvement Act of 2022|117|Senate|Ben Cardin(D) |Read twice and referred to the Committee on Small Business and Entrepreneurship.|2022-09-15|https://www.congress.gov/117/bills/s4863/BILLS-117s4863is.pdf
Protect the UNBORN Act|117|House|Andrew Clyde(R) |Referred to the Committee on Energy and Commerce, and in addition to the Committees on the Judiciary, and Ways and Means, for a period to be subsequently determined by the Speaker, in each case for consideration of such provisions as fall within the jurisdiction of the committee concerned.|2022-09-15|https://www.congress.gov/117/bills/hr8835/BILLS-117hr8835ih.pdf
Menstrual Products Right To Know Act of 2022|117|House|Grace Meng(D) |Referred to the House Committee on Energy and Commerce.|2022-09-14|https://www.congress.gov/117/bills/hr8829/BILLS-117hr8829ih.pdf
Protecting Pain-Capable Unborn Children from Late-Term Abortions Act|117|Senate|Lindsey Graham(R) |Read twice and referred to the Committee on the Judiciary.|2022-09-13|https://www.congress.gov/117/bills/s4840/BILLS-117s4840is.pdf
Pregnant Women in Custody Act|117|House|Karen Bass(D) |Placed on the Union Calendar, Calendar No. 361.|2022-09-13|https://www.congress.gov/117/bills/hr6878/BILLS-117hr6878rh.pdf
Protecting Pain-Capable Unborn Children from Late-Term Abortions Act|117|House|CHRISTOPHER SMITH(R) |Referred to the House Committee on the Judiciary.|2022-09-13|https://www.congress.gov/117/bills/hr8814/BILLS-117hr8814ih.pdf
No Federal Funds for Abortion Travel Expenses Act of 2022|117|House|Ralph Norman(R) |Referred to the House Committee on Energy and Commerce.|2022-09-06|https://www.congress.gov/117/bills/hr8776/BILLS-117hr8776ih.pdf
Expressing support for the designation of September 2022 as National Campus Sexual Assault Awareness Month.|117|House|ELEANOR NORTON(D) |Referred to the House Committee on Oversight and Reform.|2022-09-06|https://www.congress.gov/117/bills/hres1332/BILLS-117hres1332ih.pdf
Robin Danielson Menstrual Product and Intimate Care Product Safety Act of 2022|117|House|CAROLYN MALONEY(D) |Referred to the House Committee on Energy and Commerce.|2022-08-16|https://www.congress.gov/117/bills/hr8724/BILLS-117hr8724ih.pdf
Recognizing the vital, lifesaving work of crisis pregnancy centers.|117|House|Barry Moore(R) |Referred to the Committee on Energy and Commerce, and in addition to the Committee on the Judiciary, for a period to be subsequently determined by the Speaker, in each case for consideration of such provisions as fall within the jurisdiction of the committee concerned.|2022-08-05|https://www.congress.gov/117/bills/hres1314/BILLS-117hres1314ih.pdf
Community Mentors for Moms Act|117|House|Carol Miller(R) |Referred to the House Committee on Energy and Commerce.|2022-08-05|https://www.congress.gov/117/bills/hr8669/BILLS-117hr8669ih.pdf
A resolution designating August 16, 2022, as "National Airborne Day".|117|Senate|Dan Sullivan(R) |Submitted in the Senate, considered, and agreed to without amendment and with a preamble by Unanimous Consent. (consideration: CR S4033;text: CR S4047)|2022-08-04|https://www.congress.gov/117/bills/sres745/BILLS-117sres745ats.pdf
No Taxpayer Funds for Illegal Alien Abortions Act|117|Senate|Roger Marshall(R) |Read twice and referred to the Committee on the Judiciary.|2022-08-04|https://www.congress.gov/117/bills/s4770/BILLS-117s4770is.pdf
Reproductive Health Care Accessibility Act|117|Senate|Patty Murray(D) |Read twice and referred to the Committee on Health, Education, Labor, and Pensions.|2022-08-03|https://www.congress.gov/117/bills/s4764/BILLS-117s4764is.pdf
Community Mentors for Moms Act|117|Senate|Marco Rubio(R) |Read twice and referred to the Committee on Finance.|2022-08-03|https://www.congress.gov/117/bills/s4761/BILLS-117s4761is.pdf
Protecting National Access to Reproductive Care Act of 2022|117|Senate|Cory Booker(D) |Read twice and referred to the Committee on the Judiciary.|2022-08-02|https://www.congress.gov/117/bills/s4748/BILLS-117s4748is.pdf
Let Doctors Provide Reproductive Health Care Act|117|Senate|Patty Murray(D) |Read twice and referred to the Committee on the Judiciary.|2022-08-02|https://www.congress.gov/117/bills/s4723/BILLS-117s4723is.pdf
Preventing Child Sex Abuse Act of 2022|117|Senate|Charles Grassley(R) |Read twice and referred to the Committee on the Judiciary.|2022-08-02|https://www.congress.gov/117/bills/s4719/BILLS-117s4719is.pdf
Let Doctors Provide Reproductive Health Care Act|117|House|Kim Schrier(D) |Referred to the Committee on Energy and Commerce, and in addition to the Committee on the Judiciary, for a period to be subsequently determined by the Speaker, in each case for consideration of such provisions as fall within the jurisdiction of the committee concerned.|2022-08-02|https://www.congress.gov/117/bills/hr8650/BILLS-117hr8650ih.pdf
Acknowledging and commemorating the women in the Army who served in the Women's Army Auxiliary Corps and the Women's Army Corp during World War II.|117|House|Scott DesJarlais(R) |Referred to the House Committee on Armed Services.|2022-08-02|https://www.congress.gov/117/bills/hres1310/BILLS-117hres1310ih.pdf
A resolution acknowledging and commemorating the women in the Army who served in the Women's Army Auxiliary Corps and the Women's Army Corp during World War II.|117|Senate|Marsha Blackburn(R) |Referred to the Committee on Armed Services. (text: CR S3865-3866)|2022-08-02|https://www.congress.gov/117/bills/sres735/BILLS-117sres735is.pdf
Reproductive Freedom for All Act|117|Senate|Timothy Kaine(D) |Read twice and referred to the Committee on the Judiciary. (Sponsor introductory remarks on measure: CR S3806-3808)|2022-08-01|https://www.congress.gov/117/bills/s4688/BILLS-117s4688is.pdf
A resolution designating the week beginning November 7, 2022, as "National Pregnancy Center Week" to recognize the vital role that community-supported pregnancy centers play in saving lives and serving women and men faced with difficult pregnancy decisions.|117|Senate|Mike Lee(R) |Referred to the Committee on the Judiciary. (text: CR S3787-3788)|2022-07-28|https://www.congress.gov/117/bills/sres729/BILLS-117sres729is.pdf
Keeping Girls in School Act|117|House|Lois Frankel(D) |Ordered to be Reported in the Nature of a Substitute (Amended) by Voice Vote.|2022-07-28|https://www.congress.gov/117/bills/hr4134/BILLS-117hr4134ih.pdf
Pregnancy Resource Center Defense Act|117|House|Claudia Tenney(R) |Referred to the House Committee on the Judiciary.|2022-07-28|https://www.congress.gov/117/bills/hr8584/BILLS-117hr8584ih.pdf
Designating the week beginning November 7, 2022, as "National Pregnancy Center Week" to recognize the vital role that community-supported pregnancy centers play in saving lives and serving women and men faced with difficult pregnancy decisions.|117|House|Bob Good(R) |Referred to the House Committee on Energy and Commerce.|2022-07-28|https://www.congress.gov/117/bills/hres1297/BILLS-117hres1297ih.pdf
Abortion is Health Care Everywhere Act of 2022|117|Senate|Cory Booker(D) |Read twice and referred to the Committee on Foreign Relations.|2022-07-27|https://www.congress.gov/117/bills/s4641/BILLS-117s4641is.pdf
Protect Sexual and Reproductive Health Act of 2022|117|House|Cori Bush(D) |Referred to the House Committee on Energy and Commerce.|2022-07-27|https://www.congress.gov/117/bills/hr8524/BILLS-117hr8524ih.pdf
Preventing Abortion Sanctuaries Act|117|House|Doug Lamborn(R) |Referred to the Committee on Energy and Commerce, and in addition to the Committees on Education and Labor, Natural Resources, and Ways and Means, for a period to be subsequently determined by the Speaker, in each case for consideration of such provisions as fall within the jurisdiction of the committee concerned.|2022-07-26|https://www.congress.gov/117/bills/hr8501/BILLS-117hr8501ih.pdf
A resolution designating the week of July 19 through July 25, 2022, as "Black Maternal Mental Health Awareness Week" and supporting the goal of raising awareness and understanding around maternal mental health conditions as they affect Black individuals.|117|Senate|Jon Ossoff(D) |Referred to the Committee on the Judiciary. (text: CR S3641)|2022-07-25|https://www.congress.gov/117/bills/sres718/BILLS-117sres718is.pdf
A resolution recognizing, honoring, and commending the women of Ukraine who have contributed to the fight for freedom and the defense of Ukraine.|117|Senate|Jeanne Shaheen(D) |Resolution agreed to in Senate with an amendment and an amended preamble by Unanimous Consent. (consideration: CR S3602-3603; text: CR S3602-3603)|2022-07-21|https://www.congress.gov/117/bills/sres589/BILLS-117sres589ats.pdf
Lactation Spaces for Veteran Moms Act|117|Senate|Jacklyn Rosen(D) |Read twice and referred to the Committee on Veterans' Affairs.|2022-07-21|https://www.congress.gov/117/bills/s4580/BILLS-117s4580is.pdf
Reproductive Health Travel Fund Act of 2022|117|House|Marilyn Strickland(D) |Referred to the House Committee on Energy and Commerce.|2022-07-20|https://www.congress.gov/117/bills/hr8452/BILLS-117hr8452ih.pdf
LGBTQI+ and Women’s History Education Act of 2022|117|House|CAROLYN MALONEY(D) |Referred to the House Committee on House Administration.|2022-07-20|https://www.congress.gov/117/bills/hr8445/BILLS-117hr8445ih.pdf
Ensuring Access to Abortion Act of 2022|117|House|Lizzie Fletcher(D) |Received in the Senate.|2022-07-18|https://www.congress.gov/117/bills/hr8297/BILLS-117hr8297eh.pdf
Women’s Health Protection Act of 2022|117|House|Judy Chu(D) |Received in the Senate.|2022-07-18|https://www.congress.gov/117/bills/hr8296/BILLS-117hr8296eh.pdf
Protecting Access to Medication Abortion Act|117|House|Cori Bush(D) |Referred to the House Committee on Energy and Commerce.|2022-07-18|https://www.congress.gov/117/bills/hr8405/BILLS-117hr8405ih.pdf
