Alice Paul Women's Suffrage Congressional Gold Medal Act|112|House|JOE BACA(D) |Referred to the Subcommittee on Domestic Monetary Policy and Technology.|2011-10-04|https://www.congress.gov/112/bills/hr2970/BILLS-112hr2970ih.pdf
A resolution congratulating the Nunaka Valley Little League junior girls softball team on their performance in the Junior League Softball World Series.|112|Senate|Mark Begich(D) |Resolution agreed to in Senate without amendment and with a preamble by Unanimous Consent. (text: CR S5933)|2011-09-23|https://www.congress.gov/112/bills/sres273/BILLS-112sres273ats.pdf
Foodborne Illness Reduction Act of 2011|112|Senate|Kirsten Gillibrand(D) |Read twice and referred to the Committee on Agriculture, Nutrition, and Forestry.|2011-09-08|https://www.congress.gov/112/bills/s1529/BILLS-112s1529is.pdf
National Women's History Museum and Federal Facilities Consolidation and Efficiency Act of 2011|112|House|JOHN MICA(R) |Ordered to be Reported by Voice Vote.|2011-09-08|https://www.congress.gov/112/bills/hr2844/BILLS-112hr2844ih.pdf
Women WIN Jobs|112|House|Jared Polis(D) |Referred to the Subcommittee on Higher Education and Workforce Training.|2011-09-08|https://www.congress.gov/112/bills/hr2315/BILLS-112hr2315ih.pdf
Campus Sexual Violence Elimination Act|112|House|CAROLYN MALONEY(D) |Referred to the Subcommittee on Higher Education and Workforce Training.|2011-09-08|https://www.congress.gov/112/bills/hr2016/BILLS-112hr2016ih.pdf
Pregnant and Parenting Students Access to Education Act of 2011|112|House|Jared Polis(D) |Referred to the Subcommittee on Early Childhood, Elementary, and Secondary Education.|2011-09-08|https://www.congress.gov/112/bills/hr2617/BILLS-112hr2617ih.pdf
21st Century STEM for Girls and Underrepresented Minorities Act|112|House|LYNN WOOLSEY(D) |Referred to the Subcommittee on Early Childhood, Elementary, and Secondary Education.|2011-09-08|https://www.congress.gov/112/bills/hr1903/BILLS-112hr1903ih.pdf
Girls Protection Act of 2011|112|House|JOSEPH CROWLEY(D) |Referred to the Subcommittee on Crime, Terrorism, and Homeland Security.|2011-08-25|https://www.congress.gov/112/bills/hr2221/BILLS-112hr2221ih.pdf
A resolution designating August 16, 2011, as "National Airborne Day".|112|Senate|John Reed(D) |Submitted in the Senate, considered, and agreed to without amendment and with a preamble by Unanimous Consent. (consideration: CR S5284; text as passed Senate: CR S5284; text of measure as introduced: CR S5269)|2011-08-02|https://www.congress.gov/112/bills/sres254/BILLS-112sres254ats.pdf
Pregnancy Assistance Fund Expansion Act|112|Senate|Bob Casey(D) |Read twice and referred to the Committee on Health, Education, Labor, and Pensions.|2011-08-02|https://www.congress.gov/112/bills/s1490/BILLS-112s1490is.pdf
Honoring and supporting women in the Middle East and North Africa for their bravery and leadership and calling on the United States Government and the international community to recognize their vital role in democracy movements and promote the rights and empowerment of women and girls in the region.|112|House|Russ Carnahan(D) |Referred to the Subcommittee on Middle East and South Asia .|2011-08-02|https://www.congress.gov/112/bills/hres258/BILLS-112hres258ih.pdf
Communities of Color Teenage Pregnancy Prevention Act of 2011|112|House|LUCILLE ROYBAL-ALLARD(D) |Referred to the Subcommittee on Health.|2011-08-01|https://www.congress.gov/112/bills/hr2678/BILLS-112hr2678ih.pdf
Access to Birth Control Act|112|House|CAROLYN MALONEY(D) |Referred to the Subcommittee on Health.|2011-08-01|https://www.congress.gov/112/bills/hr2659/BILLS-112hr2659ih.pdf
A resolution encouraging women's political participation in Saudi Arabia.|112|Senate|BARBARA BOXER(D) |Resolution agreed to in Senate with an amendment and an amended preamble by Unanimous Consent. (consideration: CR S5049-5051; text of amendment in the nature of a substitute: CR S5050-5051)|2011-07-29|https://www.congress.gov/112/bills/sres216/BILLS-112sres216ats.pdf
Communities of Color Teenage Pregnancy Prevention Act of 2011|112|Senate|BARBARA BOXER(D) |Read twice and referred to the Committee on Health, Education, Labor, and Pensions.|2011-07-28|https://www.congress.gov/112/bills/s1437/BILLS-112s1437is.pdf
Access to Birth Control Act|112|Senate|FRANK LAUTENBERG(D) |Read twice and referred to the Committee on Health, Education, Labor, and Pensions.|2011-07-26|https://www.congress.gov/112/bills/s1415/BILLS-112s1415is.pdf
A resolution expressing the sense of the Senate regarding coming together as a Nation and ceasing all work or other activity for a moment of remembrance beginning at 1:00 PM Eastern Daylight Time on September 11, 2011, in honor of the 10th anniversary of the terrorist attacks committed against the United States on September 11, 2001.|112|Senate|FRANK LAUTENBERG(D) |Submitted in the Senate, considered, and agreed to without amendment and with a preamble by Unanimous Consent. (consideration: CR S4836-4837; text as passed Senate: CR S4836; text of measure as introduced: CR S4850)|2011-07-22|https://www.congress.gov/112/bills/sres237/BILLS-112sres237ats.pdf
Gold Medal of Remembrance for the Sons and Daughters of Our Fallen Act|112|House|DANA ROHRABACHER(R) |Referred to the Subcommittee on Domestic Monetary Policy and Technology.|2011-07-19|https://www.congress.gov/112/bills/hr1926/BILLS-112hr1926ih.pdf
Lyme and Tick-Borne Disease Prevention, Education, and Research Act of 2011|112|Senate|Richard Blumenthal(D) |Read twice and referred to the Committee on Health, Education, Labor, and Pensions.|2011-07-18|https://www.congress.gov/112/bills/s1381/BILLS-112s1381is.pdf
To provide for the establishment of the Tick-Borne Diseases Advisory Committee.|112|House|CHRISTOPHER SMITH(R) |Referred to the Subcommittee on Health.|2011-07-15|https://www.congress.gov/112/bills/hr2557/BILLS-112hr2557ih.pdf
Stop Deceptive Advertising for Women's Services Act|112|House|CAROLYN MALONEY(D) |Referred to the Subcommittee on Commerce, Manufacturing, and Trade.|2011-07-15|https://www.congress.gov/112/bills/hr2543/BILLS-112hr2543ih.pdf
Stop Deceptive Advertising for Women's Services Act|112|Senate|Robert Menendez(D) |Read twice and referred to the Committee on Commerce, Science, and Transportation.|2011-07-14|https://www.congress.gov/112/bills/s1374/BILLS-112s1374is.pdf
A resolution honoring the men and women of the National Aeronautics and Space Administration Space Shuttle Program on reaching the historic milestone of the 135th and final flight of the Space Transportation System.|112|Senate|CLARENCE NELSON(D) |Submitted in the Senate, considered, and agreed to without amendment and with a preamble by Unanimous Consent. (consideration: CR S4563-4564; text as passed Senate: CR S4563-4564; text of measure as introduced: CR S4561-4562)|2011-07-13|https://www.congress.gov/112/bills/sres233/BILLS-112sres233ats.pdf
Veterans Day Moment of Silence Act|112|Senate|Scott Brown(R) |Read twice and referred to the Committee on the Judiciary.|2011-07-12|https://www.congress.gov/112/bills/s1348/BILLS-112s1348is.pdf
Supporting the goals and ideals of the National Day of Silence in bringing attention to anti-lesbian, gay, bisexual, and transgender name-calling, bullying, and harassment faced by individuals in schools.|112|House|ELIOT ENGEL(D) |Referred to the Subcommittee on the Constitution.|2011-07-11|https://www.congress.gov/112/bills/hconres40/BILLS-112hconres40ih.pdf
A resolution expressing the sense of the Senate regarding coming together as a Nation and ceasing all work or other activity for a moment of remembrance beginning at 1:00 PM Eastern Daylight Time on September 11, 2011, in honor of the 10th anniversary of the terrorist attacks committed against the United States on September 11, 2001.|112|Senate|FRANK LAUTENBERG(D) |Referred to the Committee on the Judiciary. (text of measure as introduced: CR S4455)|2011-07-07|https://www.congress.gov/112/bills/sres228/BILLS-112sres228is.pdf
To amend title II of the Social Security Act to provide for full benefits for disabled widows and widowers without regard to age.|112|House|NITA LOWEY(D) |Referred to the Subcommittee on Social Security.|2011-07-07|https://www.congress.gov/112/bills/hr2293/BILLS-112hr2293ih.pdf
To amend title 5, United States Code, to provide that Washington's Birthday be observed on February 22, rather than the third Monday in February, of each year.|112|House|FRANK WOLF(R) |Referred to the Subcommittee on Federal Workforce, U.S. Postal Service, and Labor Policy     .|2011-06-30|https://www.congress.gov/112/bills/hr2268/BILLS-112hr2268ih.pdf
Military Access to Reproductive Care and Health for Military Women Act|112|House|LOUISE SLAUGHTER(D) |Referred to the Subcommittee on Military Personnel.|2011-06-24|https://www.congress.gov/112/bills/hr2085/BILLS-112hr2085ih.pdf
Women's Fair and Equal Right to Military Service Act|112|House|LORETTA SANCHEZ(D) |Referred to the Subcommittee on Military Personnel.|2011-06-24|https://www.congress.gov/112/bills/hr1928/BILLS-112hr1928ih.pdf
A joint resolution proposing an amendment to the Constitution of the United States relative to equal rights for men and women.|112|Senate|Robert Menendez(D) |Read twice and referred to the Committee on the Judiciary.|2011-06-22|https://www.congress.gov/112/bills/sjres21/BILLS-112sjres21is.pdf
Women and Workforce Investment for Nontraditional Jobs|112|Senate|BARBARA MIKULSKI(D) |Read twice and referred to the Committee on Health, Education, Labor, and Pensions.|2011-06-22|https://www.congress.gov/112/bills/s1252/BILLS-112s1252is.pdf
Essex National Heritage Area Reauthorization Act|112|House|JOHN TIERNEY(D) |Referred to the Subcommittee on National Parks, Forests and Public Lands.|2011-06-22|https://www.congress.gov/112/bills/hr2202/BILLS-112hr2202ih.pdf
Proposing an amendment to the Constitution of the United States relative to equal rights for men and women.|112|House|CAROLYN MALONEY(D) |Referred to the House Committee on the Judiciary.|2011-06-22|https://www.congress.gov/112/bills/hjres69/BILLS-112hjres69ih.pdf
Child Interstate Abortion Notification Act|112|Senate|Marco Rubio(R) |Read twice and referred to the Committee on the Judiciary.|2011-06-21|https://www.congress.gov/112/bills/s1241/BILLS-112s1241is.pdf
MARCH for Military Women Act|112|Senate|Kirsten Gillibrand(D) |Read twice and referred to the Committee on Armed Services.|2011-06-16|https://www.congress.gov/112/bills/s1214/BILLS-112s1214is.pdf
MOMS for the 21st Century Act|112|House|LUCILLE ROYBAL-ALLARD(D) |Referred to the Subcommittee on Health.|2011-06-15|https://www.congress.gov/112/bills/hr2141/BILLS-112hr2141ih.pdf
Foodborne Illness Reduction Act of 2011|112|Senate|Kirsten Gillibrand(D) |Read twice and referred to the Committee on Agriculture, Nutrition, and Forestry.|2011-06-08|https://www.congress.gov/112/bills/s1157/BILLS-112s1157is.pdf
NEWBORN Act|112|House|Steve Cohen(D) |Referred to the Subcommittee on Health.|2011-06-03|https://www.congress.gov/112/bills/hr2127/BILLS-112hr2127ih.pdf
Birth Defects Prevention, Risk Reduction, and Awareness Act of 2011|112|House|ROSA DELAURO(D) |Referred to the Subcommittee on Health.|2011-06-03|https://www.congress.gov/112/bills/hr2029/BILLS-112hr2029ih.pdf
Mother's Day Centennial Commemorative Coin Act|112|House|David McKinley(R) |Referred to the Subcommittee on Domestic Monetary Policy and Technology.|2011-06-02|https://www.congress.gov/112/bills/hr1736/BILLS-112hr1736ih.pdf
Supporting the goals of International Women's Day.|112|House|JANICE SCHAKOWSKY(D) |Referred to the Subcommittee on the Constitution.|2011-06-01|https://www.congress.gov/112/bills/hres148/BILLS-112hres148ih.pdf
A concurrent resolution authorizing the use of Emancipation Hall in the Capitol Visitor Center for an event to celebrate the birthday of King Kamehameha.|112|Senate|DANIEL AKAKA(D) |Motion to reconsider laid on the table Agreed to without objection.|2011-05-31|https://www.congress.gov/112/bills/sconres16/BILLS-112sconres16enr.pdf
Birth Defects Prevention, Risk Reduction, and Awareness Act of 2011|112|Senate|Kay Hagan(D) |Read twice and referred to the Committee on Health, Education, Labor, and Pensions.|2011-05-26|https://www.congress.gov/112/bills/s1131/BILLS-112s1131is.pdf
A resolution recognizing the life and service of the Honorable Hubert H. Humphrey, distinguished former Senator from the State of Minnesota and former Vice President of the United States, upon the 100th anniversary of his birth.|112|Senate|Amy Klobuchar(D) |Resolution agreed to in Senate with an amendment and with a preamble by Unanimous Consent. (text: CR S3201)|2011-05-19|https://www.congress.gov/112/bills/sres184/BILLS-112sres184ats.pdf
A bill to limit the amount expended by the Department of Defense for printing and reproduction costs.|112|Senate|TOM COBURN(R) |Read twice and referred to the Committee on Appropriations.|2011-05-18|https://www.congress.gov/112/bills/s1021/BILLS-112s1021is.pdf
Defense Sexual Trauma Response Oversight and Good Governance Act|112|House|Niki Tsongas(D) |Referred to the Subcommittee on Military Personnel.|2011-05-18|https://www.congress.gov/112/bills/hr1529/BILLS-112hr1529ih.pdf
To reduce the amounts otherwise authorized to be appropriated to the Department of Defense for printing and reproduction.|112|House|Allen West(R) |Referred to the Subcommittee on Readiness.|2011-05-18|https://www.congress.gov/112/bills/hr1246/BILLS-112hr1246rfs.pdf
Global Sexual and Reproductive Health Act of 2011|112|House|Yvette Clarke(D) |Referred to the Subcommittee on Africa, Global Health, and Human Rights.|2011-05-13|https://www.congress.gov/112/bills/hr1319/BILLS-112hr1319ih.pdf
No Taxpayer Funding for Abortion Act|112|House|CHRISTOPHER SMITH(R) |Read the second time. Placed on Senate Legislative Calendar under General Orders. Calendar No. 40.|2011-05-09|https://www.congress.gov/112/bills/hr3/BILLS-112hr3pcs.pdf
No Taxpayer Funding for Abortion Act|112|Senate|Roger Wicker(R) |Read twice and referred to the Committee on Finance.|2011-05-05|https://www.congress.gov/112/bills/s906/BILLS-112s906is.pdf
Mother's Day Centennial Commemorative Coin Act|112|Senate|JAY ROCKEFELLER(D) |Read twice and referred to the Committee on Banking, Housing, and Urban Affairs.|2011-05-05|https://www.congress.gov/112/bills/s889/BILLS-112s889is.pdf
Providing for consideration of the bill (H.R. 3) to prohibit taxpayer funded abortions and to provide for conscience protections, and for other purposes.|112|House|Richard Nugent(R) |Motion to reconsider laid on the table Agreed to without objection.|2011-05-04|https://www.congress.gov/112/bills/hres237/BILLS-112hres237eh.pdf
Commending President Barack Obama and the men and women of the military and intelligence agencies for the successful completion of the operation that led to the death of Osama bin Laden.|112|House|SHEILA JACKSON LEE(D) |Referred to the Committee on Armed Services, and in addition to the Committees on Intelligence (Permanent Select), and Homeland Security, for a period to be subsequently determined by the Speaker, in each case for consideration of such provisions as fall within the jurisdiction of the committee concerned.|2011-05-03|https://www.congress.gov/112/bills/hres240/BILLS-112hres240ih.pdf
National Women's History Museum Act of 2011|112|Senate|Susan Collins(R) |Placed on Senate Legislative Calendar under General Orders. Calendar No. 37.|2011-05-02|https://www.congress.gov/112/bills/s680/BILLS-112s680rs.pdf
Violence Against Women Health Initiative Act of 2011|112|House|LOUISE SLAUGHTER(D) |Referred to the Subcommittee on Health.|2011-04-25|https://www.congress.gov/112/bills/hr1578/BILLS-112hr1578ih.pdf
To suspend temporarily the duty on certain hydrogenated polymers of norbornene derivatives.|112|House|John Yarmuth(D) |Referred to the Subcommittee on Trade.|2011-04-19|https://www.congress.gov/112/bills/hr1503/BILLS-112hr1503ih.pdf
Trans Fat Truth in Labeling Act of 2011|112|House|STEVE ISRAEL(D) |Referred to the Subcommittee on Health.|2011-04-15|https://www.congress.gov/112/bills/hr1486/BILLS-112hr1486ih.pdf
A resolution honoring and supporting women in North Africa and the Middle East whose bravery, compassion, and commitment to putting the wellbeing of others before their own have proven that courage can be contagious.|112|Senate|Olympia Snowe(R) |Resolution agreed to in Senate with an amendment and an amended preamble by Unanimous Consent. (text: CR S2552-2553)|2011-04-14|https://www.congress.gov/112/bills/sres109/BILLS-112sres109ats.pdf
Public Agency Accountability for Sexual Harassment Act|112|Senate|Bob Casey(D) |Read twice and referred to the Committee on Health, Education, Labor, and Pensions.|2011-04-14|https://www.congress.gov/112/bills/s859/BILLS-112s859is.pdf
A resolution recognizing and supporting the goals and ideals of Sexual Assault Awareness Month.|112|Senate|Bob Casey(D) |Referred to the Committee on the Judiciary. (text of measure as introduced: CR S2542-2543)|2011-04-14|https://www.congress.gov/112/bills/sres149/BILLS-112sres149is.pdf
Campus Sexual Violence Elimination Act|112|Senate|Bob Casey(D) |Read twice and referred to the Committee on Health, Education, Labor, and Pensions.|2011-04-14|https://www.congress.gov/112/bills/s834/BILLS-112s834is.pdf
A resolution congratulating the Lady Aggies of Texas A&M University on winning the 2011 National Collegiate Athletic Association Division I Women's Basketball Championship.|112|Senate|KAY HUTCHISON(R) |Submitted in the Senate, considered, and agreed to without amendment and with a preamble by Unanimous Consent. (consideration: CR S2402; text as passed Senate: CR S2402; text of measure as introduced: CR S2399)|2011-04-12|https://www.congress.gov/112/bills/sres142/BILLS-112sres142ats.pdf
Restroom Gender Parity in Federal Buildings Act|112|House|EDOLPHUS TOWNS(D) |Referred to the Subcommittee on Government Organization, Efficiency, and Financial Management     .|2011-04-08|https://www.congress.gov/112/bills/hr1361/BILLS-112hr1361ih.pdf
A resolution supporting the goals and ideals of Take Our Daughters and Sons To Work Day.|112|Senate|Richard Burr(R) |Submitted in the Senate, considered, and agreed to without amendment and with a preamble by Unanimous Consent. (consideration: CR S2285-2286; text as passed Senate: CR S2285-2286; text of measure as introduced: CR S2281-2282)|2011-04-07|https://www.congress.gov/112/bills/sres137/BILLS-112sres137ats.pdf
To amend the Internal Revenue Code of 1986 to eliminate certain tax benefits relating to abortion.|112|House|DAVE CAMP(R) |Placed on the Union Calendar, Calendar No. 27.|2011-04-06|https://www.congress.gov/112/bills/hr1232/BILLS-112hr1232rh.pdf
A resolution designating April 5, 2011, as "Gold Star Wives Day".|112|Senate|Richard Burr(R) |Submitted in the Senate, considered, and agreed to without amendment and with a preamble by Unanimous Consent. (consideration: CR S2143; text as passed Senate: CR S2143; text of measure as introduced: CR S2140)|2011-04-05|https://www.congress.gov/112/bills/sres130/BILLS-112sres130ats.pdf
Birthright Citizenship Act of 2011|112|Senate|David Vitter(R) |Read twice and referred to the Committee on the Judiciary.|2011-04-05|https://www.congress.gov/112/bills/s723/BILLS-112s723is.pdf
To amend title 38, United States Code, to improve the disability compensation evaluation procedure of the Secretary of Veterans Affairs for veterans with post-traumatic stress disorder or mental health conditions related to military sexual trauma, and for other purposes.|112|House|Chellie Pingree(D) |Referred to the Subcommittee on Disability Assistance and Memorial Affairs.|2011-04-01|https://www.congress.gov/112/bills/hr930/BILLS-112hr930ih.pdf
National Women's History Museum Act of 2011|112|House|CAROLYN MALONEY(D) |Referred to the Subcommittee on Economic Development, Public Buildings and Emergency Management.|2011-03-31|https://www.congress.gov/112/bills/hr1269/BILLS-112hr1269ih.pdf
Honoring the life of Congresswoman Geraldine A. Ferraro, the first woman selected by a major political party as its candidate for Vice President.|112|House|JOSEPH CROWLEY(D) |Referred to the House Committee on House Administration.|2011-03-30|https://www.congress.gov/112/bills/hres190/BILLS-112hres190ih.pdf
A resolution honoring Congresswoman Geraldine A. Ferraro, the first woman selected by a major political party as its candidate for Vice President of the United States, and extending the condolences of the Senate on her death.|112|Senate|Kirsten Gillibrand(D) |Submitted in the Senate, considered, and agreed to without amendment and with a preamble by Unanimous Consent. (consideration: CR S1943; text as passed Senate: CR S1943; text of measure as introduced: CR S1939)|2011-03-29|https://www.congress.gov/112/bills/sres114/BILLS-112sres114ats.pdf
Women's Business Ownership Act of 2011|112|House|EDDIE JOHNSON(D) |Referred to the Subcommittee on Financial Institutions and Consumer Credit.|2011-03-23|https://www.congress.gov/112/bills/hr744/BILLS-112hr744ih.pdf
International Women's Freedom Act of 2011|112|House|CAROLYN MALONEY(D) |Referred to the Subcommittee on International Monetary Policy and Trade.|2011-03-23|https://www.congress.gov/112/bills/hr418/BILLS-112hr418ih.pdf
Veterans, Women, Families with Children, and Persons With Disabilities Housing Fairness Act of 2011|112|House|Al Green(D) |Referred to the Subcommittee on Insurance, Housing and Community Opportunity.|2011-03-23|https://www.congress.gov/112/bills/hr284/BILLS-112hr284ih.pdf
A concurrent resolution recognizing women serving in the United States Armed Forces.|112|Senate|BARBARA BOXER(D) |Referred to the Subcommittee on Military Personnel.|2011-03-16|https://www.congress.gov/112/bills/sconres8/BILLS-112sconres8rfh.pdf
Domestic Minor Sex Trafficking Deterrence and Victims Support Act of 2011|112|Senate|Ron Wyden(D) |Read twice and referred to the Committee on the Judiciary.|2011-03-16|https://www.congress.gov/112/bills/s596/BILLS-112s596is.pdf
To direct the Secretary of Veterans Affairs to display in each facility of the Department of Veterans Affairs a Women Veterans Bill of Rights.|112|House|BOB FILNER(D) |Referred to the Subcommittee on Health.|2011-03-15|https://www.congress.gov/112/bills/hr809/BILLS-112hr809ih.pdf
Recognizing women serving in the United States Armed Forces.|112|House|Cathy McMorris Rodgers(R) |Referred to the Subcommittee on Military Personnel.|2011-03-15|https://www.congress.gov/112/bills/hconres24/BILLS-112hconres24ih.pdf
Access to Certified Professional Midwives Act of 2011|112|House|Chellie Pingree(D) |Referred to the Subcommittee on Health.|2011-03-15|https://www.congress.gov/112/bills/hr1054/BILLS-112hr1054ih.pdf
Stillbirth Awareness and Research Act of 2011|112|House|PETER KING(R) |Referred to the Subcommittee on Health.|2011-03-15|https://www.congress.gov/112/bills/hr1037/BILLS-112hr1037ih.pdf
Maternal Health Accountability Act of 2011|112|House|JOHN CONYERS(D) |Referred to the Subcommittee on Health.|2011-03-11|https://www.congress.gov/112/bills/hr894/BILLS-112hr894ih.pdf
Supporting the goals and ideals of National Women's History Month.|112|House|LYNN WOOLSEY(D) |Referred to the House Committee on Oversight and Government Reform.|2011-03-11|https://www.congress.gov/112/bills/hres165/BILLS-112hres165ih.pdf
Fulfilling the Potential of Women in Academic Science and Engineering Act of 2011|112|House|EDDIE JOHNSON(D) |Referred to the Subcommittee on Research and Science Education.|2011-03-09|https://www.congress.gov/112/bills/hr889/BILLS-112hr889ih.pdf
Honoring the life of David Kato and all who are victims of violence in Uganda because of their sexual orientation or gender identity.|112|House|LUIS GUTIERREZ(D) |Referred to the Subcommittee on Africa, Global Health, and Human Rights.|2011-03-08|https://www.congress.gov/112/bills/hres100/BILLS-112hres100ih.pdf
A resolution supporting the goals of "International Women's Day" and recognizing this year's centennial anniversary of International Women's Day.|112|Senate|Jeanne Shaheen(D) |Submitted in the Senate, considered, and agreed to without amendment and with a preamble by Unanimous Consent. (consideration: CR S1241; text as passed Senate: CR S1241; text of measure as introduced: CR S1238)|2011-03-03|https://www.congress.gov/112/bills/sres90/BILLS-112sres90ats.pdf
Acknowledging the 42nd anniversary of the election of Shirley Anita St. Hill Chisholm, the first African-American woman in Congress.|112|House|BARBARA LEE(D) |Referred to the House Committee on House Administration.|2011-03-03|https://www.congress.gov/112/bills/hres144/BILLS-112hres144ih.pdf
HEART for Women Act|112|Senate|Debbie Stabenow(D) |Read twice and referred to the Committee on Health, Education, Labor, and Pensions.|2011-03-02|https://www.congress.gov/112/bills/s438/BILLS-112s438is.pdf
Denouncing the practices of female genital mutilation, domestic violence, "honor" killings, acid burnings, dowry deaths, and other gender-based persecutions, expressing the sense of Congress that participation, protection, recognition, and equality of women is crucial to achieving a just, moral and peaceful society, and for other purposes.|112|House|SHEILA JACKSON LEE(D) |Referred to the Subcommittee on Africa, Global Health, and Human Rights.|2011-03-01|https://www.congress.gov/112/bills/hjres12/BILLS-112hjres12ih.pdf
Expressing the sense of the House of Representatives that the Senate should ratify the Convention on the Elimination of All Forms of Discrimination Against Women (CEDAW).|112|House|LYNN WOOLSEY(D) |Referred to the Subcommittee on Africa, Global Health, and Human Rights.|2011-03-01|https://www.congress.gov/112/bills/hres20/BILLS-112hres20ih.pdf
Proposing an amendment to the Constitution of the United States relating to equality of rights and reproductive rights.|112|House|JESSE JACKSON(D) |Referred to the Subcommittee on the Constitution.|2011-02-28|https://www.congress.gov/112/bills/hjres31/BILLS-112hjres31ih.pdf
